id,title,link,image,tag,preview,author,timestamp
1123,Cô gái giúp nhà hàng Việt ở Mỹ đang ế ẩm bỗng đông kín khách chỉ sau một video,https://vietnamnet.vn/co-gai-giup-nha-hang-viet-o-my-dang-e-am-thanh-dong-kin-khach-chi-sau-mot-video-2112251.html,https://static-images.vnncdn.net/files/publish/2023/2/25/nha-hang-viet-o-my-3-509.jpg?width=245,DU LỊCH,"Một Tiktoker chia sẻ video về nhà hàng Việt Nam đang vắng khách của bố mẹ mình. Video này đã thu hút sự cảm thông từ những người dùng TikTok, nhiều vị khách ghé thăm, thưởng thức món ăn Việt.",Ngọc Tân,25/02/2023   11:15 (GMT+07:00)
1124,HLV Philippe Troussier nhận chỉ tiêu bất ngờ tại SEA Games,https://vietnamnet.vn/hlv-philippe-troussier-nhan-chi-tieu-bat-ngo-tai-sea-games-2113964.html,https://static-images.vnncdn.net/files/publish/2023/2/24/philippe-troussier-3-1188.jpg?width=245,THỂ THAO,VFF chưa vội đưa ra chỉ tiêu cao nhất với tân thuyền trưởng Philippe Troussier tại SEA Games 32 diễn ra ở Campuchia vào tháng 5 tới.,Đại Nam,25/02/2023   11:07 (GMT+07:00)
1125,Đệ nhất phu nhân Mỹ tiết lộ kế hoạch tái tranh cử của chồng,https://vietnamnet.vn/de-nhat-phu-nhan-my-tiet-lo-ke-hoach-tai-tranh-cu-cua-chong-2114142.html,https://static-images.vnncdn.net/files/publish/2023/2/25/screenshot-2023-02-25-at-105547-1-498.jpg?width=245,THẾ GIỚI,Đệ nhất phu nhân Mỹ Jill Biden vừa đưa ra một trong những dấu hiệu rõ ràng nhất về việc chồng bà - Tổng thống Mỹ Joe Biden sẽ tái tranh cử nhiệm kỳ II.,Hoài Linh,25/02/2023   11:06 (GMT+07:00)
1126,"Bị nhân tình của chồng chọc giận, tôi lập tức rút đơn ly hôn",https://vietnamnet.vn/phat-hien-chong-ngoai-tinh-va-bi-nhan-tinh-choc-gian-vo-lap-tuc-rut-don-ly-hon-2114072.html,https://static-images.vnncdn.net/files/publish/2023/2/25/untitled-2-299.jpg?width=245,ĐỜI SỐNG,"Hai năm trước tôi phát hiện chồng ngoại tình. Như hầu hết những bà vợ bị phản bội khác, tôi sốc không dám nghĩ đó là sự thật. Nhưng chồng tôi đã nhận sai và hứa dừng lại mối quan hệ bất chính.",Anonymous,25/02/2023   11:00 (GMT+07:00)
1127,"Bắt nóng kẻ dùng bình xịt hơi cay, súng điện cướp tiền ở cửa hàng vắng",https://vietnamnet.vn/bat-nong-ke-dung-binh-xit-hoi-cay-sung-dien-cuop-tien-cua-hang-viettel-bao-nghi-2114134.html,https://static-images.vnncdn.net/files/publish/2023/2/25/332933931-678397210728413-6212208669673686797-n-473.jpg?width=245,THỜI SỰ,"Bà chủ cửa hàng dù bị xịt hơi cay choáng váng nhưng đã lao theo, kéo xe khiến kẻ cướp té ngã, bị người dân bắt giữ.",Đàm Đệ,25/02/2023   10:58 (GMT+07:00)
1128,Novaland hoán đổi cổ phần cho đối tác ngoại để hủy lô trái phiếu 4.600 tỷ đồng,https://vietnamnet.vn/novaland-hoan-doi-co-phan-cho-doi-tac-ngoai-de-huy-lo-trai-phieu-4-600-ty-dong-2114132.html,https://static-images.vnncdn.net/files/publish/2023/2/25/buithanhnhon-1-466.jpg?width=245,TÀI CHÍNH,Novaland vừa hoán đổi cổ phần tại 2 công ty thành viên cho đối tác ngoại để hủy các lô trái phiếu trị giá nghìn tỷ đồng.,Mạnh Hà,25/02/2023   10:45 (GMT+07:00)
1129,Bi kịch của người mẫu Thái Thiên Phượng vừa bị sát hại ở tuổi 28,https://vietnamnet.vn/bi-kich-cua-nguoi-mau-thai-thien-phuong-bi-sat-hai-da-man-o-tuoi-28-2114114.html,https://static-images.vnncdn.net/files/publish/2023/2/25/bi-kich-cua-nguoi-mau-thai-thien-phuong-vua-bi-sat-hai-o-tuoi-28-1a05884e341b4528a6f11ef8e0352903-469.jpeg?width=245,GIẢI TRÍ,Truyền thông Trung Quốc hôm nay xôn xao về việc người mẫu nổi tiếng Thái Thiên Phượng (Abby Choi) bị sát hại.,Anonymous,25/02/2023   10:36 (GMT+07:00)
1130,Trường cao đẳng tặng Iphone 14 cho tất cả tân sinh viên,https://vietnamnet.vn/truong-cao-dang-trung-quoc-tang-iphone-14-cho-tat-ca-tan-sinh-vien-2113983.html,https://static-images.vnncdn.net/files/publish/2023/2/25/329135090-509579408010271-9150621823115332879-n-1-442.jpg?width=245,DU HỌC,"Trường Cao đẳng Nghề ôtô Hy Vọng Tứ Xuyên, Trung Quốc ra thông báo tặng Iphone 14 cho tất cả sinh viên nhập học vào tháng 9/2023.",Anonymous,25/02/2023   10:28 (GMT+07:00)
1131,"Khám xét, thu giữ nhiều thùng tài liệu tại nhà bà Đặng Thị Hàn Ni",https://vietnamnet.vn/kham-xet-nha-cua-ba-dang-thi-han-ni-2114129.html,https://static-images.vnncdn.net/files/publish/2023/2/25/kham-xe-han-ni-1-1-432.jpg?width=245,THỜI SỰ,"Sáng 25/2, lực lượng Công an, Viện KSND TP.HCM đã đưa bà Đặng Thị Hàn Ni về nhà riêng tại quận 7 để khám xét, tiến hành các bước tố tụng theo quy định.",Đàm Đệ,25/02/2023   10:25 (GMT+07:00)
1132,"Barca mất 1,25 triệu euro vì bàn thắng của Lewandowski vào lưới MU",https://vietnamnet.vn/barca-mat-1-25-trieu-euro-vi-ban-thang-cua-lewandowski-vao-luoi-mu-2114131.html,https://static-images.vnncdn.net/files/publish/2023/2/25/lewandowski-casemiro-426.jpg?width=245,THỂ THAO,"Barca không những bị MU loại khỏi sân chơi châu Âu mà còn mất thêm 1,25 triệu euro vì bàn thắng từ chấm 11m của Lewandowski.",Lâm Hoàng,25/02/2023   10:21 (GMT+07:00)
1133,Gelex chỉ còn phải trả hơn 880 tỷ đồng trái phiếu đến hạn trong năm 2023,https://vietnamnet.vn/gelex-chi-con-phai-tra-hon-880-ty-dong-trai-phieu-den-han-trong-nam-2023-2114124.html,https://static-images.vnncdn.net/files/publish/2023/2/25/gelex-gex-419.jpg?width=245,TÀI CHÍNH,"Theo báo cáo tài chính hợp nhất của GELEX, dư hạn trái phiếu đến hạn phải trả trong vòng 1 năm (tại thời điểm 31/12/2022) của doanh nghiệp này là 1236 tỷ.",Mạnh Hà,25/02/2023   10:13 (GMT+07:00)
1134,Tin lời đồn thấy đá quý khiến dân đổ xô đến đào bới ven sông ở Yên Bái,https://vietnamnet.vn/tin-loi-don-thay-da-quy-khien-dan-do-xo-den-dao-boi-ven-song-o-yen-bai-2114099.html,https://static-images.vnncdn.net/files/publish/2023/2/25/dao-da-412.jpg?width=245,THỜI SỰ,"Thời gian gần đây, tại bãi cát sông Chảy thuộc địa phận xã Minh Chuẩn (huyện Lục Yên), rất nhiều người đến đào xới, tìm kiếm đá quý.",Nhị Tiến,25/02/2023   10:03 (GMT+07:00)
1135,"Thủ tướng: Chuyển đổi số cần đi trước, đón đầu, có giải pháp trước các công nghệ mới",https://vietnamnet.vn/chuyen-doi-so-can-di-truoc-don-dau-co-giai-phap-truoc-cac-cong-nghe-moi-2114106.html,https://static-images.vnncdn.net/files/publish/2023/2/25/img6730-16772891103431617019160-405.jpg?width=245,CHÍNH TRỊ,"Với các công nghệ mới phát triển nhanh như AI, Blockchain, ChatGPT… Thủ tướng yêu cầu cần đánh giá phản ứng trước những vấn đề mới, tiếp tục có giải pháp phù hợp với điều kiện Việt Nam.",Trần Thường,25/02/2023   10:02 (GMT+07:00)
1136,Dược Nam Hà tri ân cán bộ ngành y nhân ngày Thầy thuốc Việt Nam,https://vietnamnet.vn/duoc-nam-ha-tri-an-can-bo-nganh-y-nhan-ngay-thay-thuoc-viet-nam-2114103.html,https://static-images.vnncdn.net/files/publish/2023/2/25/avttttttt-338.jpg?width=245,TƯ VẤN SỨC KHỎE,"Công ty Cổ phần Dược phẩm Nam Hà đồng hành tổ chức Lễ Tri ân Thầy thuốc Việt Nam nhân ngày 27/2  nhằm tôn vinh các y bác sĩ, dược sĩ, nhân viên y tế vì những cống hiến cao cả để bảo vệ, chăm sóc và nâng cao sức khỏe người dân.",Anonymous,25/02/2023   10:00 (GMT+07:00)
1137,"Có hơn 1,2 tỷ đồng nên chọn Hyundai Santa Fe hay sedan BMW 320i?",https://vietnamnet.vn/1-2-ty-dong-chon-hyundai-santa-fe-hay-sedan-bmw-320i-2113602.html,https://static-images.vnncdn.net/files/publish/2023/2/25/capture-72.jpg?width=245,Ô TÔ - XE MÁY,"Cùng mức giá khoảng trên dưới 1,2 tỷ đồng, nhiều người phân vân không biết nên mua xe SUV gầm cao Hyundai Santa Fe hay sedan hạng sang BMW 320i.",Y Nhụy,25/02/2023   10:00 (GMT+07:00)
1138,Dự đoán tỷ số Ngoại hạng Anh hôm nay 25/2,https://vietnamnet.vn/du-doan-ty-so-ngoai-hang-anh-hom-nay-25-2-2113750.html,https://static-images.vnncdn.net/files/publish/2023/2/25/leicester-city-arsenal-2-385.jpg?width=245,THỂ THAO,Dự đoán tỷ số Ngoại hạng Anh hôm nay ngày 25/2/2023 - Dự đoán tỷ số các trận đấu thuộc vòng 25 Premier League chính xác nhất.,Thiên Bình,25/02/2023   09:53 (GMT+07:00)
1139,"Giá vàng hôm nay 25/2: Vàng trong nước 'hụt hơi', mất mốc 67 triệu đồng",https://vietnamnet.vn/gia-vang-hom-nay-25-2-giam-manh-truoc-ap-luc-tang-lai-suat-2113996.html,https://static-images.vnncdn.net/files/publish/2023/2/24/gia-vang-the-gioi-1367.jpg?width=245,TÀI CHÍNH,Giá vàng thế giới giảm mạnh về gần mốc 1.800 USD/ounce trong bối cảnh nhà đầu tư lo ngại Cục Dự trữ Liên bang Mỹ (Fed) tiếp tục tăng lãi suất trong một thời gian dài. Giá vàng trong nước mất mốc 67 triệu đồng/lượng.,Duy Anh,25/02/2023   09:52 (GMT+07:00)
1140,Sao PSG cả gan chọc tức cả Messi lẫn Neymar,https://vietnamnet.vn/sao-psg-sap-bat-bai-vi-choc-tuc-ca-messi-lan-neymar-2114120.html,https://static-images.vnncdn.net/files/publish/2023/2/25/messi-vitinha-377.jpg?width=245,THỂ THAO,"Sao PSG, Vitinha khiến Messi nổi nóng trên sân tập, trong khi tiền vệ người Bồ cũng bị Neymar chỉ trích vì chơi kém.",Lâm Hoàng,25/02/2023   09:50 (GMT+07:00)
1141,"TP.HCM phát hiện một phòng khám vẽ bệnh, moi tiền",https://vietnamnet.vn/tp-hcm-phat-hien-phong-kham-ve-benh-moi-tien-2114112.html,https://static-images.vnncdn.net/files/publish/2023/2/25/tai-xuong-364.png?width=245,SỨC KHỎE,"Nhận phản ánh của người dân, Thanh tra Sở Y tế TP.HCM đã kiểm tra và xử lý một phòng khám đa khoa ""vẽ bệnh, moi tiền"".",Linh Giao,25/02/2023   09:41 (GMT+07:00)
1142,Đóng bảo hiểm xã hội 15 năm được hưởng lương hưu thế nào?,https://vietnamnet.vn/dong-bao-hiem-xa-hoi-15-nam-duoc-huong-luong-huu-the-nao-2114098.html,https://static-images.vnncdn.net/files/publish/2023/2/25/lao-dong-thanh-tung-366.jpg?width=245,THỜI SỰ,"Các chuyên gia cho rằng, nguyên tắc đóng BHXH để có lương hưu là tích lũy cả đời, vì thế người đóng thời gian dài sẽ có lương hưu cao. Ngược lại, người tham gia muộn, đóng BHXH ngắn, tiền đóng ít thì lương hưu sẽ thấp.",Vũ Điệp,25/02/2023   09:41 (GMT+07:00)
1143,Tổng thống Zelensky tuyên bố Ukraine chuẩn bị giành lại Crưm,https://vietnamnet.vn/tong-thong-zelensky-tuyen-bo-ukraine-chuan-bi-gianh-lai-crum-2114109.html,https://static-images.vnncdn.net/files/publish/2023/2/25/ukraine-president-361.jpg?width=245,THẾ GIỚI,"Phát biểu tại một cuộc họp báo ngày 24/2, Tổng thống Ukraine Volodymir Zelensky cho biết nước này đang chuẩn bị cho một cuộc tấn công và giành lại Crưm.",Hoài Linh,25/02/2023   09:35 (GMT+07:00)
1144,"Tướng quân đội kể về quyết định 'cân não' khi cứu hộ, cứu nạn tại Thổ Nhĩ Kỳ",https://vietnamnet.vn/tuong-quan-doi-ke-ve-quyet-dinh-can-nao-khi-cuu-ho-cuu-nan-tai-tho-nhi-ky-2113991.html,https://static-images.vnncdn.net/files/publish/2023/2/25/c652643f9d2947771e38-356.jpg?width=245,QUỐC PHÒNG,"Với vai trò chỉ huy lực lượng cứu hộ, cứu nạn QĐND Việt Nam tại Thổ Nhĩ Kỳ, Thiếu tướng Phạm Văn Tỵ đã cùng 76 chiến sĩ vượt qua nhiều khó khăn, đưa ra những quyết định kịp thời, trợ giúp người dân sau thảm họa động đất.",Trần Thường,25/02/2023   09:27 (GMT+07:00)
1145,ĐH Luật TP.HCM lập tổ công tác xử lý tiến sĩ Đặng Anh Quân,https://vietnamnet.vn/truong-dh-luat-tp-hcm-lap-to-cong-tac-xu-ly-tien-si-luat-dang-anh-quan-2114105.html,https://static-images.vnncdn.net/files/publish/2023/2/25/tien-si-luat-259-353.jpeg?width=245,NGƯỜI THẦY,"PGS Trần Hoàng Hải, Quyền hiệu trưởng Trường ĐH Luật TP.HCM cho hay, ông đã chỉ đạo lập tổ công tác xem xét mức độ vi phạm của ông Đặng Anh Quân.",Lê Huyền,25/02/2023   09:23 (GMT+07:00)
1146,Madonna chia tay bạn trai kém 41 tuổi sau 5 tháng yêu,https://vietnamnet.vn/madonna-chia-tay-ban-trai-kem-41-tuoi-sau-5-thang-yeu-2114101.html,https://static-images.vnncdn.net/files/publish/2023/2/25/madona-349.jpeg?width=245,GIẢI TRÍ,Giọng ca 64 tuổi và bạn trai kém 41 tuổi quyết định đường ai nấy đi.,Anonymous,25/02/2023   09:22 (GMT+07:00)
1147,Tìm thấy nữ sinh lớp 6 rời nhà để lại thư 'con đi chơi ít ngày rồi về',https://vietnamnet.vn/tim-thay-nu-sinh-lop-6-roi-nha-de-lai-thu-con-di-choi-it-ngay-roi-ve-2114083.html,https://static-images.vnncdn.net/files/publish/2023/2/25/331859128-588309376542747-6564746455430428398-n-1-335.jpg?width=245,THỜI SỰ,"Công an xã Kỳ Đồng (huyện Kỳ Anh, Hà Tĩnh) cho biết, các lực lượng và gia đình vừa tìm thấy nữ sinh lớp 6 rời nhà đi. Hiện cháu N. đã về nhà và tâm lý ổn định.",Thiện Lương,25/02/2023   09:17 (GMT+07:00)
1148,‘Sao nhập ngũ’ 2023: Thùy Anh khóc khi chia tay đồng đội,https://vietnamnet.vn/sao-nhap-ngu-2023-thuy-anh-bat-khoc-khi-chia-tay-dong-doi-2114068.html,https://static-images.vnncdn.net/files/publish/2023/2/25/ava-snn08-326.jpg?width=245,GIẢI TRÍ,"Nhã Phương, Thùy Anh, Thiên Ân và Linh Ngọc Đàm phải chia tay đồng đội và chuyển đến nơi khác vì thành tích chưa tốt trong tập 8 'Sao nhập ngũ' 2023.",Huy Minh,25/02/2023   09:10 (GMT+07:00)
1149,Quảng bá văn hóa ẩm thực Việt Nam - Nhật Bản tại Thành phố Hồ Chí Minh,https://vietnamnet.vn/quang-ba-van-hoa-am-thuc-viet-nam-nhat-ban-tai-thanh-pho-ho-chi-minh-2114097.html,https://static-images.vnncdn.net/files/publish/2023/2/25/nhatban-263.png?width=245,GÓC NHÌN,"Ngày 24/2/2023, Hội thảo xu hướng mới nhất về văn hóa ẩm thực Việt Nam - Nhật Bản trong khuôn khổ Lễ hội Việt - Nhật lần thứ 8 tại TP.HCM (JVF) được tổ chức tại Khách sạn Nikko Saigon, quận 1, TP.HCM.",Anonymous,25/02/2023   09:10 (GMT+07:00)
1150,Tìm phương án hạn chế máy bay phải vòng chờ khi thời tiết xấu,https://vietnamnet.vn/tim-phuong-an-han-che-may-bay-phai-vong-cho-khi-thoi-tiet-xau-2114093.html,https://static-images.vnncdn.net/files/publish/2023/2/25/anh-chup-man-hinh-2023-02-25-luc-85215-sa-1-323.png?width=245,THỜI SỰ,"Yếu tố thời tiết gây ảnh hưởng lớn cho các chuyến bay, nhiều trường hợp tàu bay phải vòng chờ bay đi bay lại làm gia tăng chi phí và tăng nguy cơ uy hiếp an toàn bay.",N. Huyền,25/02/2023   09:09 (GMT+07:00)
1151,Bắt tạm giam thầy giáo sàm sỡ nhiều học sinh lớp 5 ở Nghệ An,https://vietnamnet.vn/bat-tam-giam-thay-giao-sam-so-nhieu-hoc-sinh-lop-5-o-nghe-an-2114084.html,https://static-images.vnncdn.net/files/publish/2023/2/25/dai-dien-thay-1-320.jpg?width=245,PHÁP LUẬT,"Nam giáo viên bị cơ quan công an khởi tố, bắt tạm giam để điều tra hành vi dâm ô với trẻ em, nạn nhân là học sinh trong trường.",Trần Văn Tuyên,25/02/2023   09:07 (GMT+07:00)
1152,"Lisandro Martinez thú nhận tính xấu, nơm nớp lo sẽ hại MU",https://vietnamnet.vn/lisandro-martinez-thu-nhan-tinh-xau-nom-nop-lo-se-hai-mu-2114102.html,https://static-images.vnncdn.net/files/publish/2023/2/25/lisandro-martinez-mu-2-0-leeds-1-316.jpg?width=245,THỂ THAO,"Chiến binh Lisandro Martinez thú nhận rất khó để kiểm soát sự hung hăng, hiếu chiến của mình nên cứ nơm nớp lo có thể hại MU.",Lâm Hoàng,25/02/2023   09:07 (GMT+07:00)
1153,Đài Loan tặng tiền cho du khách nước ngoài,https://vietnamnet.vn/dai-loan-tang-tien-cho-du-khach-nuoc-ngoai-2113920.html,https://static-images.vnncdn.net/files/publish/2023/2/25/taiwan-1-1-313.jpg?width=245,DU LỊCH,Đài Loan dự kiến tặng 165 USD/người cho khoảng 500.000 du khách quốc tế năm 2023.,Ngọc Tân,25/02/2023   09:02 (GMT+07:00)
1154,Mặt tối phía sau ngành công nghiệp triệu đô pin xe điện: Có đáng để đánh đổi?,https://vietnamnet.vn/mat-toi-phia-sau-nganh-cong-nghiep-trieu-do-pin-xe-dien-2114005.html,https://static-images.vnncdn.net/files/publish/2023/2/25/anh-1-65.jpg?width=245,Ô TÔ - XE MÁY,"Không chỉ môi trường mà những người lao động và người dân tại ""thủ phủ niken"" của Indonesia đang kêu cứu trước những tác hại khôn lường từ quá trình khai thác và tinh chế niken sử dụng trong pin xe điện.",Nhật Minh,25/02/2023   09:00 (GMT+07:00)
1155,Cô giáo Hà Nội ‘truyền lửa’ học tiếng Anh theo cách đặc biệt,https://vietnamnet.vn/co-giao-ha-noi-truyen-lua-hoc-tieng-anh-theo-cach-dac-biet-2113953.html,https://static-images.vnncdn.net/files/publish/2023/2/24/violet-pham-a-1274.jpg?width=245,HỌC TIẾNG ANH,"Cô Phạm Thị Khuyên (Violet Phạm) được nhiều phụ huynh, học sinh yêu quý khi tích cực truyền cảm hứng học tiếng Anh thông qua các bài giảng, hoạt động, cuộc thi thú vị.",Anonymous,25/02/2023   09:00 (GMT+07:00)
1156,Đảo thiên đường nơi giới nhà giàu Australia đi du thuyền tới nghỉ dưỡng cuối tuần,https://vietnamnet.vn/dao-rottnest-noi-gioi-nha-giau-australia-di-du-thuyen-toi-nghi-duong-cuoi-tuan-2113869.html,https://static-images.vnncdn.net/files/publish/2023/2/24/rottnest-island-perth-1389.jpg?width=245,DU LỊCH,"Vào mỗi dịp cuối tuần, giới nhà giàu ở miền Tây Australia thường chọn Rottnest làm nơi nghỉ dưỡng, ngắm cảnh và tận hưởng khung cảnh thanh bình.",Hoàng Hà,25/02/2023   09:00 (GMT+07:00)
1157,Thành phố nào xây những tòa nhà chọc trời cách đây gần 800 năm?,https://vietnamnet.vn/thanh-pho-nao-xay-duoc-nhung-toa-nha-choc-troi-cach-day-gan-800-nam-2113645.html,https://static-images.vnncdn.net/files/publish/2023/2/24/faccb30588f352ad0be2-413.jpg?width=245,TRẮC NGHIỆM,"Vào thế kỷ XII, thành phố này đã xây hàng trăm tòa nhà chọc trời cao đến 94m, ngang với một số công trình hiện đại ngày nay.",Thúy Nga,25/02/2023   09:00 (GMT+07:00)
1158,Người mẫu Thái Thiên Phượng bị sát hại dã man ở tuổi 28,https://vietnamnet.vn/nguoi-mau-bi-sat-hai-da-man-o-tuoi-28-2114089.html,https://static-images.vnncdn.net/files/publish/2023/2/25/thaithienphuong-309.jpeg?width=245,GIẢI TRÍ,"Trước khi người mẫu Abby Choi (Thái Thiên Phượng) bị sát hại, người nhà thông báo cô mất tích trên đường đi đón con.",Anonymous,25/02/2023   08:59 (GMT+07:00)
1159,"Nga, Mỹ phản ứng trái ngược về đề xuất chấm dứt xung đột ở Ukraine của Trung Quốc",https://vietnamnet.vn/nga-my-phan-ung-trai-nguoc-ve-de-xuat-cham-dut-xung-dot-ukraine-cua-trung-quoc-2114094.html,https://static-images.vnncdn.net/files/publish/2023/2/25/joe-biden-284.jpg?width=245,THẾ GIỚI,"Tổng thống Mỹ Joe Biden cho rằng, đề xuất của Trung Quốc về kế hoạch chấm dứt cuộc xung đột ở Ukraine nếu được triển khai sẽ chỉ có lợi cho Nga.",Tuấn Anh,25/02/2023   08:50 (GMT+07:00)
1160,Những 'công xưởng' gỗ chiếm hết vỉa hè đường Đê La Thành,https://vietnamnet.vn/nhung-cong-xuong-go-chiem-het-via-he-duong-de-la-thanh-2114007.html,https://static-images.vnncdn.net/files/publish/2023/2/25/z4135514383247-dadb11fa4146c3eadc36a82aea618e31-251-389.jpg?width=245,THỜI SỰ,"Thêm một điểm người dân bức xúc về tình trạng chiếm vỉa hè như có ""sổ đỏ"", đó là phố Đê La Thành (Hà Nội), nơi đây như công xưởng sản xuất và bày bán đồ gỗ nội thất.",Bảo Khánh,25/02/2023   08:48 (GMT+07:00)
1161,Nàng dâu rơi vào thập tử nhất sinh vẫn nén đau giấu mẹ chồng,https://vietnamnet.vn/nang-dau-roi-vao-thap-tu-nhat-sinh-van-nen-dau-2114076.html,https://static-images.vnncdn.net/files/publish/2023/2/25/anhdd-246.jpg?width=245,ĐỜI SỐNG,"Con dâu lâm bạo bệnh chỉ 0,1% cơ hội sống vẫn nén đau giấu giếm mẹ chồng. Ngày thứ 3 sau cuộc phẫu thuật, cô trốn bệnh viện trở về nhà, cố gắng đi lại, nói chuyện với mẹ chồng như không có gì.",Tú Linh,25/02/2023   08:47 (GMT+07:00)
1162,"Đam mê thần tượng suốt 25 năm, 8X Hà thành làm nên điều không tưởng",https://vietnamnet.vn/dam-me-than-tuong-suot-25-nam-8x-ha-thanh-lam-nen-dieu-khong-tuong-2113929.html,https://static-images.vnncdn.net/files/publish/2023/2/25/giang6-235.jpg?width=245,ĐỜI SỐNG,"Biết Giang hâm mộ nhóm nhạc 911 nhưng không ai trong gia đình nghĩ có ngày cô lại đi uống cà phê, chuyện trò vui vẻ và làm việc cùng những người này.",Vũ Lụa,25/02/2023   08:41 (GMT+07:00)
1163,Màn biểu diễn của Rihanna bị chê vì gợi dục,https://vietnamnet.vn/man-bieu-dien-cua-rihanna-bi-che-vi-goi-duc-2114092.html,https://static-images.vnncdn.net/files/publish/2023/2/25/screen-shot-2023-02-25-at-083048-230.png?width=245,GIẢI TRÍ,Rihanna đã có màn xuất hiện ấn tượng trên sân khấu Super Bowl LVII khi để lộ bụng bầu. Nhưng hiện tại nhiều khán giả chỉ trích phần trình diễn gợi dục.,Anonymous,25/02/2023   08:34 (GMT+07:00)
1164,"Lập nhóm né tránh chốt CSGT, người đàn ông bị xử phạt 7,5 triệu",https://vietnamnet.vn/lap-nhom-ne-tranh-chot-csgt-nguoi-dan-ong-bi-xu-phat-7-5-trieu-dong-2114081.html,https://static-images.vnncdn.net/files/publish/2023/2/25/chot-edited-1677256691946-1-203.png?width=245,THỜI SỰ,"Cơ quan công an quyết định xử phạt hành chính một người đàn ông có hành vi lập nhóm Zalo để báo cho các thành viên về hoạt động kiểm tra của CSGT, nhằm né tránh.",Thiện Lương,25/02/2023   08:24 (GMT+07:00)
1165,HLV Potter bị dọa giết vì Chelsea bết bát,https://vietnamnet.vn/hlv-potter-bi-doa-giet-vi-chelsea-bet-bat-2114088.html,https://static-images.vnncdn.net/files/publish/2023/2/25/graham-potter-1-199.jpg?width=245,THỂ THAO,Nhà cầm quân 47 tuổi cùng vợ con nhận những lời dọa giết từ fan Chelsea quá khích do thành tích bết bát của đội bóng.,Lâm Hoàng,25/02/2023   08:19 (GMT+07:00)
1166,"Bị bạn bè xa lánh, thần đồng 22 tuổi trở thành nhà khoa học nổi tiếng",https://vietnamnet.vn/bi-ban-be-xa-lanh-than-dong-22-tuoi-tro-thanh-nha-khoa-hoc-noi-tieng-2112437.html,https://static-images.vnncdn.net/files/publish/2023/2/23/331898002-715349023416780-1292535672450055358-n-1-1-919.png?width=245,GƯƠNG MẶT TRẺ,"Thần đồng Trung Quốc Tào Nguyên vào đại học năm 14 tuổi, 8 năm sau trở thành nhà khoa học nổi tiếng, nhưng tuổi thơ của anh phải sống trong cảnh bị bạn bè cô lập, xa lánh.",Anonymous,25/02/2023   08:15 (GMT+07:00)
1167,"Phở Thìn Lò Đúc và loạt quán phở Hà Nội 'đắt cắt cổ', thực khách tranh cãi tối ngày",https://vietnamnet.vn/pho-thin-lo-duc-va-loat-quan-pho-ha-noi-dat-cat-co-thuc-khach-tranh-cai-2113727.html,https://static-images.vnncdn.net/files/publish/2023/2/25/pho-thin-301.jpg?width=245,DU LỊCH,"Phở Thìn Lò Đúc, phở gà Châm Yên Ninh... được xếp vào hạng đắt đỏ nhất Hà thành. Tuy mức giá cả trăm ngàn/bát, gây tranh cãi nhưng đây vẫn là địa chỉ ưa thích của nhiều thực khách.",Linh Trang,25/02/2023   08:15 (GMT+07:00)
1168,Cơ hội nào cho thị trường bất động sản?,https://vietnamnet.vn/co-hoi-nao-cho-thi-truong-bat-dong-san-2114032.html,https://static-images.vnncdn.net/files/publish/2023/2/25/bat-dong-san-296.jpg?width=245,TUẦN VIỆT NAM,Khoảng 70% khó khăn của doanh nghiệp bất động sản là liên quan đến pháp lý nên cần rất nhiều thời gian để sửa đổi. Doanh nghiệp “được vạ thì má đã sưng”.,Trần Văn Tường,25/02/2023   08:14 (GMT+07:00)
1169,Rashford nguy cơ lỡ chung kết cúp Liên đoàn Anh,https://vietnamnet.vn/rashford-nguy-co-lo-chung-ket-cup-lien-doan-anh-2114086.html,https://static-images.vnncdn.net/files/publish/2023/2/25/rashford-187.jpg?width=245,THỂ THAO,"HLV Ten Hag xác nhận, Marcus Rashford có thể vắng mặt trận chung kết cup Liên đoàn Anh gặp Newcastle vì chấn thương mới gặp phải ở cuộc đấu Barcelona.",An Nhi,25/02/2023   08:12 (GMT+07:00)
1170,‘Bác sĩ không phải là người đặc biệt nhưng nghề y là nghề đặc biệt’,https://vietnamnet.vn/bac-si-khong-phai-la-nguoi-dac-biet-nhung-nghe-y-la-nghe-dac-biet-2113856.html,https://static-images.vnncdn.net/files/publish/2023/2/24/image00a-893.jpg?width=245,TIN TỨC,"Chia sẻ “Nghề y là một nghề đặc biệt; dạy học ngành y lại càng đặc thù”, Thiếu tướng, PGS.TS.BS, Thầy thuốc nhân dân Nguyễn Hồng Sơn khẳng định: “Với tôi được làm nghề thầy thuốc và thầy giáo là tuyệt vời nhất”.",Anonymous,25/02/2023   08:00 (GMT+07:00)
