id,title,link,image,tag,preview,author,timestamp
784,Rộ tin máy bay A-50 Nga bị phá hoại ở căn cứ không quân Belarus,https://vietnamnet.vn/may-bay-canh-bao-a-50-nga-bi-pha-hoai-o-can-cu-khong-quan-belarus-2114688.html,https://static-images.vnncdn.net/files/publish/2023/2/27/a-50-2-487.jpg?width=245,THẾ GIỚI,"Theo truyền thông Belarus, máy bay cảnh báo sớm A-50 của Không quân Nga đã bị hư hại nặng sau một vụ tấn công ở sân bay Machulishchi gần thủ đô Minsk hôm 26/2.",Tuấn Trần,27/02/2023   10:26 (GMT+07:00)
785,7 cách thông minh để sắp xếp hộp đựng thực phẩm,https://vietnamnet.vn/7-cach-thong-minh-de-sap-xep-hop-dung-thuc-pham-2114619.html,https://static-images.vnncdn.net/files/publish/2023/2/27/cach-xep-gon-hop-nhua-dung-thuc-pham-464.jpg?width=245,ĐỜI SỐNG,Có nhiều loại hộp thực phẩm sẽ khiến tủ bếp và ngăn kéo của bạn trở nên lộn xộn. Tham khảo mẹo sắp xếp dưới đây để mang lại hiệu quả cao về lâu dài đồng thời giúp bạn tiết kiệm thời gian và chi phí.,Anonymous,27/02/2023   10:23 (GMT+07:00)
786,Điều đặc biệt về hệ thống đường sắt đưa Tổng thống Mỹ Biden tới Kiev,https://vietnamnet.vn/dieu-dac-biet-ve-he-thong-duong-sat-dua-tong-thong-my-biden-toi-ukraine-2114672.html,https://static-images.vnncdn.net/files/publish/2023/2/27/biden-toi-ukraine-1-466.jpg?width=245,THẾ GIỚI,"Hành trình tới Kiev dài 10 tiếng đồng hồ của ông Biden được giữ bí mật tuyệt đối, và trở thành thách thức an ninh đối với Tập đoàn Đường sắt Ukraine Ukrzaliznytsia.",Minh Thu,27/02/2023   10:23 (GMT+07:00)
787,Ăn trứng gà có nguy cơ lây nhiễm H5N1 không?,https://vietnamnet.vn/q-a-an-trung-gia-cam-co-nguy-co-lay-nhiem-cum-h5n1-khong-2114153.html,https://static-images.vnncdn.net/files/publish/2023/2/27/trung-gia-cam-445.jpg?width=245,SỨC KHỎE,Trứng gia cầm nhiễm bệnh cúm A/H5N1 có thể lây cho người sử dụng. Tỷ lệ lây nhiễm phụ thuộc vào thời gian và mức độ tiếp xúc.,Phương Thuý,27/02/2023   10:18 (GMT+07:00)
788,Làm thế nào để khiến cuộc sống thêm thú vị?,https://vietnamnet.vn/lam-the-nao-de-khien-cuoc-song-them-thu-vi-2114611.html,https://static-images.vnncdn.net/files/publish/2023/2/27/cuoc-song-them-thu-vi-442.jpg?width=245,ĐỜI SỐNG,"Mỗi ngày, chúng ta đều trải qua một guồng quay của những thói quen và công việc bộn bề. Chính những điều này có thể dẫn tới sự nhàm chán và khiến bạn muốn phá cách để được sống theo cách thú vị hơn.",Anonymous,27/02/2023   10:15 (GMT+07:00)
789,Sao MU tiết lộ thói quen gây choáng của Erik ten Hag,https://vietnamnet.vn/sao-mu-tiet-lo-thoi-quen-gay-choang-cua-erik-ten-hag-2114694.html,https://static-images.vnncdn.net/files/publish/2023/2/27/erik-ten-hag-cup-2-438.jpg?width=245,THỂ THAO,MU vừa vô địch Carabao Cup và hậu vệ trái Tyrell Malacia tiết lộ một phần về Erik ten Hag nơi ‘hậu trường’ khiến nhiều người không khỏi choáng.,Lâm Hoàng,27/02/2023   10:12 (GMT+07:00)
790,Cục Đăng kiểm huy động cả cán bộ bị khởi tố đi làm,https://vietnamnet.vn/cuc-dang-kiem-phai-huy-dong-ca-can-bo-dien-tai-ngoai-di-lam-2114571.html,https://static-images.vnncdn.net/files/publish/2023/2/27/dang-kiem-437-1203.jpg?width=245,THỜI SỰ,Ngành đăng kiểm phải huy động cả cán bộ bị khởi tố được tại ngoại đi làm vì năng lực kiểm định hiện chỉ đạt trên 50% số lượng phương tiện có nhu cầu.,N. Huyền,27/02/2023   10:09 (GMT+07:00)
791,"ĐT U20 Việt Nam đổ bộ Uzbekistan, sẵn sàng đấu Australia, Iran",https://vietnamnet.vn/dt-u20-viet-nam-do-bo-uzbekistan-san-sang-dau-australia-iran-2114670.html,https://static-images.vnncdn.net/files/publish/2023/2/27/u20-vietnam-431.jpeg?width=245,THỂ THAO,"Sau chuyến bay từ Dubai (UAE) kéo dài gần 4 tiếng đồng hồ, U20 Việt Nam đã đến Fergana (Uzbekistan), sẵn sàng bước vào thử thách tại VCK U20 châu Á 2023.",Đại Nam,27/02/2023   10:06 (GMT+07:00)
792,"Chỉ vì chiếc điện thoại, 2 học sinh tử vong vì bị đâm thấu ngực tại trường",https://vietnamnet.vn/2-hoc-sinh-tq-tu-vong-vi-bi-dam-thau-nguc-thung-dong-mach-chu-2113785.html,https://static-images.vnncdn.net/files/publish/2023/2/27/333216690-898101714803763-3560803448198130314-n-1-1-270.jpg?width=245,GÓC PHỤ HUYNH,"Hai học sinh trường THCS Kỹ thuật Chiết Giang, Trung Quốc tử vong vì bị đâm thủng ngực và động mạch chủ trong vụ bạo lực học đường do thu điện thoại của một học sinh trong lớp.",Anonymous,27/02/2023   10:03 (GMT+07:00)
793,"FPT Polytechnic tặng học bổng, bộ gậy tập cho đội tuyển võ gậy Quốc gia",https://vietnamnet.vn/fpt-polytechnic-tang-hoc-bong-bo-gay-tap-cho-doi-tuyen-vo-gay-quoc-gia-2114669.html,https://static-images.vnncdn.net/files/publish/2023/2/27/img-09505-a-375.jpg?width=245,CÁC MÔN KHÁC,Trường Cao đẳng FPT Polytechnic tài trợ nhiều dụng cụ luyện tập cùng học bổng ý nghĩa cho các VĐV Đội tuyển Võ gậy (Arnis) Quốc gia.,Anonymous,27/02/2023   10:00 (GMT+07:00)
794,Hinode City - không gian sống theo chuẩn Nhật giữa lòng Hà Nội,https://vietnamnet.vn/hinode-city-khong-gian-song-theo-chuan-nhat-giua-long-ha-noi-2114678.html,https://static-images.vnncdn.net/files/publish/2023/2/27/image00a-405.jpg?width=245,DỰ ÁN,"Không chỉ thuyết phục khách hàng bằng những giá trị về phong cách sống, tiện ích và thiết kế kiểu Nhật, dự án Hinode City (201 Minh Khai, Hà Nội) còn hướng tới không gian sống xanh cùng loạt tiện ích bảo vệ sức khỏe.",Anonymous,27/02/2023   10:00 (GMT+07:00)
795,Vụ người mẫu 28 tuổi bị sát hại: Bắt giữ nhân tình của bố chồng cũ,https://vietnamnet.vn/vu-nguoi-mau-thai-thien-phuong-bi-sat-hai-bat-giu-nhan-tinh-cua-bo-chong-cu-2114643.html,https://static-images.vnncdn.net/files/publish/2023/2/27/331552330-2468947593260831-7334894072124068191-n-1-1-382.jpg?width=245,GIẢI TRÍ,Nghi phạm mới của vụ án sát hại Thái Thiên Phượng là người phụ nữ 47 tuổi có quan hệ tình ái với bố chồng cũ của nạn nhân.,Anonymous,27/02/2023   09:50 (GMT+07:00)
796,Ý niệm về văn hóa Đảng,https://vietnamnet.vn/y-niem-ve-van-hoa-dang-2114658.html,https://static-images.vnncdn.net/files/publish/2023/2/27/ho-guom-371.jpg?width=245,TUẦN VIỆT NAM,"Để lãnh đạo bằng văn hóa chính trị, Đảng cần định hình rõ bản sắc văn hóa chính trị, không chỉ góp phần tạo nên văn hóa dân tộc mà còn tạo động lực khiến mỗi cá nhân được hấp dẫn và tự giác chấp nhận các giá trị, niềm tin, và chuẩn mực chính trị.",Nguyễn Văn Đáng,27/02/2023   09:43 (GMT+07:00)
797,Đảng Cộng hòa yêu cầu ông Trump cam kết ủng hộ ứng viên Tổng thống Mỹ 2024,https://vietnamnet.vn/dang-cong-hoa-yeu-cau-ong-trump-cam-ket-ung-ho-ung-vien-tong-thong-my-2024-2114649.html,https://static-images.vnncdn.net/files/publish/2023/2/27/trump-reuters2023-copy-339.jpg?width=245,THẾ GIỚI,"Đảng Cộng hòa đã yêu cầu mọi ứng viên Tổng thống Mỹ trong đảng, bao gồm cả ông Trump, phải cam kết ủng hộ người thắng vòng bầu cử sơ bộ.",Việt Dũng,27/02/2023   09:36 (GMT+07:00)
798,Hai quán phở Thìn nổi tiếng nhất Hà Nội thực khách thường nhầm lẫn,https://vietnamnet.vn/hai-quan-pho-thin-noi-tieng-nhat-ha-noi-thuc-khach-thuong-nham-lan-2114333.html,https://static-images.vnncdn.net/files/publish/2023/2/26/185573281-134200935520067-4728281091000493558-n-260.jpg?width=245,DU LỊCH,"Lâu nay, không ít người vẫn nhầm lẫn giữa hai thương hiệu phở Thìn lâu năm của Hà Nội là ""Phở Thìn Bờ Hồ"" và ""Phở Thìn 13 Lò Đúc"".",Linh Trang,27/02/2023   09:35 (GMT+07:00)
799,Bài mẫu viết thư UPU lần thứ 52: Hãy tưởng tượng là siêu nhân người nhện,https://vietnamnet.vn/bai-mau-viet-thu-upu-lan-thu-52-hay-tuong-tuong-la-sieu-anh-hung-2114650.html,https://static-images.vnncdn.net/files/publish/2023/2/27/sieu-nhan-nguoi-nhen-334.jpeg?width=245,KHOA HỌC,"Cuộc thi viết thư UPU lần thứ 52 cũng sắp hết hạn, các em học sinh có thể tham khảo bài mẫu sau đây để tìm cho mình ý tưởng thật hay nhé.",Hoàng Thanh,27/02/2023   09:28 (GMT+07:00)
800,"MU ăn mừng League Cup, Casemiro không quên mắng Bruno Fernandes",https://vietnamnet.vn/mu-an-mung-league-cup-casemiro-khong-quen-mang-bruno-fernandes-2114662.html,https://static-images.vnncdn.net/files/publish/2023/2/27/casemiro-bruno-fernandes-2-329.jpg?width=245,THỂ THAO,"MU giành chiếc cúp đầu tiên dưới thời Erik ten Hag và trong lúc ăn mừng, Casemiro không quên kéo Bruno Fernandes lại để… mắng vì đã chơi ích kỷ, lỡ bàn thắng của đội nhà.",Lâm Hoàng,27/02/2023   09:22 (GMT+07:00)
801,Học phí Trường ĐH Bách khoa TP.HCM cao nhất hơn 800 triệu/năm,https://vietnamnet.vn/hoc-phi-truong-dh-bach-khoa-tp-hcm-cao-nhat-hon-800-trieu-nam-2114625.html,https://static-images.vnncdn.net/files/publish/2023/2/27/bach-khoa-326.jpeg?width=245,TUYỂN SINH,"Trường ĐH Bách khoa TP.HCM công bố học phí năm 2023-2024. Theo đó mức thấp nhất là 30 triệu/năm, cao nhất (chương trình chuyển tiếp) khoảng 566-807 triệu đồng/năm",Lê Huyền,27/02/2023   09:18 (GMT+07:00)
802,Sống ê chề vì bị em chồng phát hiện bí mật,https://vietnamnet.vn/tam-su-chuyen-song-e-che-vi-bi-em-chong-phat-hien-viec-noi-xau-me-chong-2114584.html,https://static-images.vnncdn.net/files/publish/2023/2/27/anhdd-pxfuel-323.jpg?width=245,ĐỜI SỐNG,"Em chồng mang bí mật của tôi nói với mẹ và anh trai. Kể từ đó, tôi sống những ngày tháng khổ sở, uất ức.",Anonymous,27/02/2023   09:12 (GMT+07:00)
803,"TP.HCM: Nhóm bạn trẻ ngâm mình vớt rác, ‘hồi sinh’ các dòng kênh đen",https://vietnamnet.vn/tp-hcm-nhom-ban-tre-ngam-minh-vot-rac-hoi-sinh-cac-dong-kenh-den-2114165.html,https://static-images.vnncdn.net/files/publish/2023/2/27/sai-gon-xanh-321.jpg?width=245,VIDEO,"Sau 3 tháng thành lập, nhóm Sài Gòn xanh đã thu gom hơn 500 bao rác tại các dòng kênh trên quận Tân Bình, quận Gò Vấp, TP. Thủ Đức,...",Đình Tuyến,Unknown
804,NSND Lê Khanh từng nghĩ đạo diễn Trần Anh Hùng là 'lão điên’,https://vietnamnet.vn/nsnd-le-khanh-tung-nghi-dao-dien-tran-anh-hung-la-lao-dien-2114592.html,https://static-images.vnncdn.net/files/publish/2023/2/27/thumbnail-319.jpg?width=245,VIDEO,"Tại talkshow ""Con đường trở thành diễn viên điện ảnh thực thụ"", NSND Lê Khanh kể lại trải nghiệm lần đầu thử vai phim ""Mùa hè chiều thẳng đứng"" của đạo diễn Trần Anh Hùng những năm 1990.",Anonymous,Unknown
805,Tháp Quỷ 50 triệu tuổi là danh thắng số một tại quốc gia nào?,https://vietnamnet.vn/thap-quy-50-trieu-tuoi-la-danh-thang-so-mot-tai-quoc-gia-nao-2114621.html,https://static-images.vnncdn.net/files/publish/2023/2/27/e121449b990e43501a1f-255.jpg?width=245,TRẮC NGHIỆM,Tháp Quỷ có cấu trúc kỳ lạ bằng đá nguyên khối cao hàng trăm mét. Đỉnh tháp có diện tích gấp đôi sân bóng đá. Hiện Tháp Quỷ đang là địa điểm thu hút khách du lịch từ khắp nơi trên thế giới.,Thúy Nga,27/02/2023   09:04 (GMT+07:00)
806,"Xe gầm cao 700 triệu, chọn KIA Seltos hay chờ Xpander Cross sắp ra mắt?",https://vietnamnet.vn/gia-xe-gam-cao-700-trieu-chon-kia-seltos-hay-cho-xpander-cross-moi-2114178.html,https://static-images.vnncdn.net/files/publish/2023/2/26/kia-seltos-vs-xpander-cross-913.jpg?width=245,Ô TÔ - XE MÁY,"KIA Seltos hướng đến sự trẻ trung, thời trang và đã được kiểm chứng; trong khi đó Mitsubishi Xpander Cross 2023 sắp ra mắt lại có bề ngoài khoẻ khoắn, đa dụng với 7 chỗ ngồi.",Anonymous,27/02/2023   09:00 (GMT+07:00)
807,Dàn sao tiềm năng của U20 Việt Nam tại Cúp bóng đá U20 Châu Á 2023,https://vietnamnet.vn/dan-sao-tiem-nang-cua-u20-viet-nam-tai-cup-bong-da-u20-chau-a-2023-2114651.html,https://static-images.vnncdn.net/files/publish/2023/2/27/thumb-600x400-342.jpg?width=245,BÓNG ĐÁ VIỆT NAM,"Chỉ còn ít ngày nữa, U20 Việt Nam sẽ bắt đầu hành trình ở Cúp bóng đá U20 Châu Á AFC Uzbekistan 2023. Tại giải đấu lần này, HLV Hoàng Anh Tuấn sở hữu đội hình khá đồng đều, sẵn sàng tạo nên bất ngờ trước những đối thủ mạnh.",Anonymous,27/02/2023   09:00 (GMT+07:00)
808,Video UAV cảm tử Ukraine tập kích thiết giáp Nga từ phía sau,https://vietnamnet.vn/xem-uav-cam-tu-ukraine-tap-kich-thiet-giap-nga-tu-phia-sau-2114635.html,https://static-images.vnncdn.net/files/publish/2023/2/27/bmp-11-312.jpg?width=245,THẾ GIỚI,Ưu điểm của các máy bay không người lái (UAV) cảm tử là hệ thống điện tử lắp trên chúng có thể lựa chọn tấn công vào những điểm yếu của khí tài đối phương.,Tuấn Trần,27/02/2023   09:00 (GMT+07:00)
809,"Người đàn ông đã chết 11 năm bất ngờ trở về, cả gia đình sửng sốt",https://vietnamnet.vn/nguoi-dan-ong-da-chet-11-nam-bat-ngo-tro-ve-ca-gia-dinh-sung-sot-2114631.html,https://static-images.vnncdn.net/files/publish/2023/2/27/ong-lao-da-mat-tro-ve-308.jpg?width=245,ĐỜI SỐNG,"Cách đây 11 năm, ông Chu được xác định đã mất trong một vụ tai nạn xe hơi. Cả gia đình đã lo liệu tang lễ và luôn thờ phụng ông cẩn thận, không ngờ chuyện khó tin lại xảy ra.",Anonymous,27/02/2023   08:45 (GMT+07:00)
810,Bảng xếp hạng Ngoại hạng Anh mới nhất: Tottenham bám đuổi MU,https://vietnamnet.vn/bang-xep-hang-ngoai-hang-2022-23-anh-moi-nhat-2114125.html,https://static-images.vnncdn.net/files/publish/2023/2/26/chelsea-tottenham-956.jpg?width=245,THỂ THAO,Bảng xếp hạng bóng đá Ngoại hạng Anh 2022-2023 - Cập nhật liên tục bảng xếp hạng bóng đá Ngoại hạng Anh mùa giải 2022-23 nhanh và chính xác nhất.,Thiên Bình,27/02/2023   08:44 (GMT+07:00)
811,Bảng xếp hạng Serie A 2022-23 hôm nay: Thành Milan đua gắt top 2,https://vietnamnet.vn/bang-xep-hang-serie-a-2022-23-hom-nay-2114327.html,https://static-images.vnncdn.net/files/publish/2023/2/27/ac-milan-306.jpg?width=245,THỂ THAO,Bảng xếp hạng bóng đá Serie A 2022-2023 - Cập nhật liên tục bảng xếp hạng bóng đá Serie A mùa giải 2022-2023 nhanh và chính xác nhất.,Thiên Bình,27/02/2023   08:43 (GMT+07:00)
812,Bảng xếp hạng Bundesliga 2022-23 hôm nay: Dortmund đua song mã với Bayern Munich,https://vietnamnet.vn/bang-xep-hang-bundesliga-2022-23-hom-nay-2114331.html,https://static-images.vnncdn.net/files/publish/2023/2/27/bayern-munich-304.jpg?width=245,THỂ THAO,Bảng xếp hạng bóng đá Bundesliga 2022-2023 - Cập nhật liên tục bảng xếp hạng bóng đá Bundesliga mùa giải 2022-2023 nhanh và chính xác nhất.,Thiên Bình,27/02/2023   08:42 (GMT+07:00)
813,"Bảng xếp hạng La Liga 2022-23 hôm nay: Barca gục ngã, Real có cửa bám đuổi",https://vietnamnet.vn/bang-xep-hang-la-liga-2022-23-hom-nay-2114339.html,https://static-images.vnncdn.net/files/publish/2023/2/27/almeria-1-0-barca-8-303.jpg?width=245,THỂ THAO,Bảng xếp hạng bóng đá La Liga 2022-2023 - Cập nhật liên tục bảng xếp hạng bóng đá La Liga mùa giải 2022-2023 nhanh và chính xác nhất.,Thiên Bình,27/02/2023   08:39 (GMT+07:00)
814,"Bảng xếp hạng Ligue 1 2022-23 hôm nay: Messi, Mbappe giúp PSG bay cao",https://vietnamnet.vn/bang-xep-hang-ligue-1-2022-23-hom-nay-2114336.html,https://static-images.vnncdn.net/files/publish/2023/2/27/marseille-0-3-psg-5-302.jpg?width=245,THỂ THAO,Bảng xếp hạng bóng đá Ligue 1 2022-2023 - Cập nhật liên tục bảng xếp hạng bóng đá Ligue 1 mùa giải 2022-2023 nhanh và chính xác nhất.,Thiên Bình,27/02/2023   08:37 (GMT+07:00)
815,Trưởng công an phường tử vong trong tư thế treo cổ tại trụ sở,https://vietnamnet.vn/truong-cong-an-phuong-tu-vong-trong-tu-the-treo-co-tai-tru-so-2114627.html,https://static-images.vnncdn.net/files/publish/2023/2/27/anh-treo-co-1-295.jpg?width=245,THỜI SỰ,Các chiến sĩ trực ban phát hiện ông N.H.A. tử vong trong tư thế treo cổ tại nhà xe của trụ sở công an phường.,Công Sáng,27/02/2023   08:32 (GMT+07:00)
816,Nghịch lý trong doanh thu báo chí tại Việt Nam,https://vietnamnet.vn/nghich-ly-trong-doanh-thu-bao-chi-tai-viet-nam-2114634.html,https://static-images.vnncdn.net/files/publish/2023/2/27/bao-chi-thu-phi-1-ko-logo-1089-292.jpg?width=245,ICTNEWS,"Báo chí Việt Nam đã đóng góp vào việc phòng, chống đại dịch Covid-19. Song, nghịch lý là, doanh thu báo chí lại ghi nhận sự sụt giảm mạnh dù tỷ lệ người xem, người đọc tăng lên.",Anonymous,26/02/2023   06:15 (GMT+07:00)
817,"Bộ trưởng Nga nói về việc mở rộng chiến dịch, Ảrập Xêút viện trợ 400 triệu USD cho Ukraine",https://vietnamnet.vn/nga-noi-ve-viec-mo-rong-chien-dich-arap-xeut-vien-tro-400-trieu-do-cho-ukraine-2114608.html,https://static-images.vnncdn.net/files/publish/2023/2/27/sergey-shoigu-285.jpg?width=245,THẾ GIỚI,Bộ trưởng Quốc phòng Nga Sergey Shoigu đã đề cập đến điều kiện để Moscow mở rộng chiến dịch quân sự đặc biệt ở Ukraine.,Tuấn Anh,27/02/2023   08:27 (GMT+07:00)
818,Hoa hậu Đỗ Mỹ Linh: 'Chồng hội tụ đủ yếu tố tôi mong muốn',https://vietnamnet.vn/hoa-hau-do-my-linh-noi-ve-kinh-nghiem-khi-lam-dau-gia-dinh-hao-mon-2114589.html,https://static-images.vnncdn.net/files/publish/2023/2/27/domylinh-297.jpeg?width=245,GIẢI TRÍ,"Hoa hậu Đỗ Mỹ Linh chia sẻ, sau khi lấy chồng tự lập và không còn vô tư, thích gì làm nấy như khi còn độc thân.",Hàn Triệt,27/02/2023   08:26 (GMT+07:00)
819,"Sir Alex vỗ tay không ngớt, nâng cúp cùng HLV Erik Ten Hag",https://vietnamnet.vn/sir-alex-vo-tay-khong-ngot-nang-cup-cung-hlv-erik-ten-hag-2114624.html,https://static-images.vnncdn.net/files/publish/2023/2/27/sir-a-lex-vs-ten-hag-294.jpg?width=245,THỂ THAO,"Sir Alex Ferguson, nhà Glazer và ban lãnh đạo MU vỗ tay không ngớt, chúc mừng thầy trò HLV Ten Hag giành chức vô địch đầu tiên sau 6 năm.",Thiên Bình,27/02/2023   08:24 (GMT+07:00)
820,"Erik ten Hag bỏ quên cúp của MU, hài hước ‘chữa cháy’ cực siêu",https://vietnamnet.vn/erik-ten-hag-bo-quen-cup-cua-mu-hai-huoc-chua-chay-cuc-sieu-2114629.html,https://static-images.vnncdn.net/files/publish/2023/2/27/erik-ten-hag-cup-262.jpg?width=245,THỂ THAO,"Erik ten Hag có màn ‘chữa cháy’ cực siêu sau khi bỏ quên chiếc Cúp Liên đoàn Anh vừa giành được cùng MU, trong phòng họp báo sau trận đấu ở Wembley.",Lâm Hoàng,27/02/2023   08:24 (GMT+07:00)
821,Kỷ niệm nhớ đời của NSND Lê Khanh với đạo diễn Trần Anh Hùng,https://vietnamnet.vn/ky-niem-nho-doi-cua-nsnd-le-khanh-voi-dao-dien-tran-anh-hung-2114532.html,https://static-images.vnncdn.net/files/publish/2023/2/27/untitled-09258a-251.jpg?width=245,GIẢI TRÍ,"''Tôi đến gặp đạo diễn Trần Anh Hùng cứ tưởng sẽ phải làm gì ghê gớm lắm. Thế mà ông ấy cứ hỏi tôi biết hát bài này, bài kia không'' - NSND Lê Khanh chia sẻ.",Huy Minh,27/02/2023   08:18 (GMT+07:00)
822,Bác sĩ cúi đầu tri ân bệnh nhân trước khi nhận tạng,https://vietnamnet.vn/bac-si-cui-dau-tri-an-benh-nhan-truoc-khi-nhan-tang-2114586.html,https://static-images.vnncdn.net/files/publish/2023/2/27/mac-niem-1-245.jpg?width=245,SỨC KHỎE,"Bệnh viện Chợ Rẫy và Việt Đức đang trong giai đoạn thiếu thốn trang thiết bị, vật tư y tế. Mặc dù vậy, các bác sĩ vẫn phối hợp nhịp nhàng để thực hiện thành công ca ghép tim phức tạp.",Linh Giao,27/02/2023   08:16 (GMT+07:00)
823,'Chàng trai Vàng' Olympic Toán quốc tế: Không có thần dược giúp giỏi Toán,https://vietnamnet.vn/chang-trai-vang-olympic-toan-quoc-te-chia-se-bi-quyet-hoc-tap-2114423.html,https://static-images.vnncdn.net/files/publish/2023/2/27/ngo-quy-dang22-242.jpg?width=245,GƯƠNG MẶT TRẺ,Ngô Quý Đăng - chủ nhân 2 huy chương vàng và là nam sinh Việt đạt điểm tuyệt đối Olympic Toán quốc tế có những chia sẻ liên quan đến tình yêu Toán học và bí quyết học tập.,Hoàng Thanh,27/02/2023   08:14 (GMT+07:00)
824,Cách lái địa hình khó nếu ô tô đủ các tính năng off-road,https://vietnamnet.vn/cach-lai-dia-hinh-kho-neu-o-to-du-cac-tinh-nang-off-road-2114597.html,https://static-images.vnncdn.net/files/publish/2023/2/27/anh-chup-man-hinh-2023-02-27-luc-0501-107.jpg?width=245,Ô TÔ - XE MÁY,"Sở hữu một chiếc bán tải hay SUV dẫn động bốn bánh kèm các tính năng off-road xịn xò, nhưng người lái phải sử dụng thế nào để phát huy hiệu quả trên đường địa hình khó?",Đình Quý,27/02/2023   08:00 (GMT+07:00)
825,"Dịch qua, hè tới nhưng loạt khách sạn ở Đà Nẵng vẫn đóng cửa im lìm",https://vietnamnet.vn/dich-qua-he-toi-nhung-loat-khach-san-o-da-nang-van-dong-cua-im-lim-2114139.html,https://static-images.vnncdn.net/files/publish/2023/2/25/name-72-644.jpg?width=245,DU LỊCH,"Dẫu chuẩn bị bước vào mùa du lịch cao điểm nhưng nhiều khách sạn ở Đà Nẵng đóng cửa im lìm. Tính từ khi xảy ra dịch Covid-19, nhiều khách sạn đã đóng cửa gần 3 năm không hoạt động.",Diệu Thuỳ,27/02/2023   07:55 (GMT+07:00)
826,"Đoạt giải Nobel năm 17 tuổi, cô gái 'vượt cửa tử' truyền cảm hứng cho hàng triệu người",https://vietnamnet.vn/dat-nobel-nam-17-tuoi-nguoi-phu-nu-vuot-cua-tu-truyen-cam-hung-trieu-nguoi-2108628.html,https://static-images.vnncdn.net/files/publish/2023/2/24/scr4191-526.png?width=245,GƯƠNG MẶT TRẺ,"Năm 14 tuổi, Malala Yousafzai bị bắn vào đầu nhưng may mắn sống sót. Ở tuổi 17, cô trở thành người trẻ nhất đoạt giải Nobel vì những nỗ lực thúc đẩy quyền giáo dục cho trẻ em gái.",Anonymous,27/02/2023   07:30 (GMT+07:00)
827,Điều khoản 'cấm' tiết lộ với người đòi tiền 'gửi tiết kiệm thành mua bảo hiểm',https://vietnamnet.vn/dieu-khoan-cam-tiet-lo-cho-nguoi-doi-tien-gui-tiet-kiem-thanh-mua-bao-hiem-2113718.html,https://static-images.vnncdn.net/files/publish/2023/2/25/hop-dong-chi-hbn1-343.jpg?width=245,TÀI CHÍNH,"Trong khi nhiều khách hàng gửi tiết kiệm ngân hàng bị biến thành hợp đồng mua bảo hiểm nhân thọ Manulife vẫn chật vật đi đòi tiền, có một số người đã được trả lại tiền nhưng buộc phải ký cam kết không được tiết lộ với bên thứ ba.",Tuân Nguyễn,27/02/2023   07:18 (GMT+07:00)
828,Lịch thi đấu bóng đá hôm nay 27/2,https://vietnamnet.vn/lich-thi-dau-bong-da-hom-nay-27-2-2114409.html,https://static-images.vnncdn.net/files/publish/2023/2/26/villarreal-vs-getafe-206.jpg?width=245,THỂ THAO,"Cung cấp lịch thi đấu bóng đá hôm nay 27/2/2023, với các giải đấu hàng đầu châu Âu đêm nay, rạng sáng mai.",Thiên Bình,27/02/2023   07:15 (GMT+07:00)
829,Ten Hag gây bão với điệu nhảy cùng trò cưng MU,https://vietnamnet.vn/erik-ten-hag-gay-bao-voi-dieu-nhay-cung-tro-cung-mu-2114596.html,https://static-images.vnncdn.net/files/publish/2023/2/27/mu-newcastle-100.jpg?width=245,THỂ THAO,HLV Ten Hag gây sốt cộng đồng mạng khi nhảy cùng Antony và Lisandro Martinez ăn mừng chức vô địch cúp Liên đoàn Anh cùng MU.,An Nhi,27/02/2023   07:08 (GMT+07:00)
830,Xe máy cổ Sachs Ischia rỉ sét vẫn có giá đắt đỏ ngang Honda SH,https://vietnamnet.vn/gia-xe-may-co-sachs-ischia-ri-set-dat-ngang-gia-honda-sh-2114298.html,https://static-images.vnncdn.net/files/publish/2023/2/26/name-3-1-899.jpg?width=245,Ô TÔ - XE MÁY,Chiếc xe máy cổ Sachs Ischia đã qua 68 năm sử dụng với ngoại hình rỉ sét nhưng vẫn được chủ xe ở An Giang chào bán với giá khá cao lên đến 75 triệu đồng.,Y Nhụy,27/02/2023   07:08 (GMT+07:00)
831,"Ngân hàng tuyển người truy dấu tài sản thế chấp, hé lộ việc như phim hành động",https://vietnamnet.vn/ngan-hang-tuyen-nhan-vien-truy-dau-tai-san-the-chap-he-lo-viec-nhu-phim-hanh-dong-2114316.html,https://static-images.vnncdn.net/files/publish/2023/2/27/xe-thanh-ly-213.jpg?width=245,THỊ TRƯỜNG,"Với những tài sản thế chấp là động sản như ô tô, tàu biển... khách không trả nợ, không hợp tác bàn giao tài sản, ngân hàng phải truy tìm, phục kích như trong phim hành động. Không ít các tình huống bi hài xảy ra",Tuân Nguyễn,27/02/2023   07:07 (GMT+07:00)
