id,title,link,image,tag,preview,author,timestamp
1,Căn hộ nhỏ không nhất thiết phải có bàn ăn,https://zingnews.vn/can-ho-nho-khong-nhat-thiet-phai-co-ban-an-post1406669.html,https://znews-photo.zingcdn.me/w360/Uploaded/jqkpvowk/2023_02_25/pexels_daniel_frese_744484_1.jpg,,"Bàn ăn có thể dùng như bàn làm việc khi cần thiết. Tuy nhiên, với căn hộ nhỏ, bạn có thể thay thế món nội thất này bằng bàn trà hoặc bàn đảo phòng bếp để tiết kiệm diện tích.",,
2,Sát hại người tình rồi tự tử,https://zingnews.vn/sat-hai-nguoi-tinh-roi-tu-tu-post1407159.html,https://znews-photo.zingcdn.me/w360/Uploaded/rohunuk/2022_11_02/c1_15851160309121568403889.jpg,PHÁP LUẬT,"Sau khi đâm tử vong người tình, Trí dùng dao đâm vào bụng để tự tử nhưng không chết.",Việt Tường,27/2/2023 14:21 (GMT+7)
3,Xét xử tổng giám đốc Phú An Thịnh Land lừa bán dự án 'ma',https://zingnews.vn/xet-xu-tong-giam-doc-phu-an-thinh-land-lua-ban-du-an-ma-post1407095.html,https://znews-photo.zingcdn.me/w360/Uploaded/bzivolby/2023_02_27/z4140915354560_f9b9b9edd090d504975610a176114c7a.jpg,PHÁP LUẬT,"Tổng giám đốc Phú An Thịnh Land Ngô Minh Khâm và đồng phạm bị đưa ra xét xử về hành vi lừa bán dự án ""ma"" cho hàng chục bị hại, chiếm đoạt hơn 74 tỷ đồng.",Dương Quỳnh Trang,27/2/2023 10:47 (GMT+7)
4,Hàng trăm biệt thự bỏ hoang tại khu đô thị hơn 7.000 tỷ,https://zingnews.vn/hang-tram-biet-thu-bo-hoang-tai-khu-do-thi-hon-7000-ty-post1405882.html,https://znews-photo.zingcdn.me/w360/Uploaded/ayhunaa/2023_02_22/KDTduongnoi3_zing.jpg,XÃ HỘI,"Hàng trăm biệt thự trong dự án khu đô thị Dương Nội (quận Hà Đông, Hà Nội) đang trong tình trạng hoang vắng dù nằm tại vị trí đắc địa ở phía tây thủ đô.",Thụy Trang,27/2/2023 10:03 (GMT+7)
5,Trưởng công an phường tử vong trong tư thế treo cổ tại nhà xe cơ quan,https://zingnews.vn/truong-cong-an-phuong-tu-vong-trong-tu-the-treo-co-tai-nha-xe-co-quan-post1407052.html,https://znews-photo.zingcdn.me/w360/Uploaded/lce_mdlwc/2023_02_27/img_1665308384020_1665308422688.jpg,XÃ HỘI,"Người dân phường Điện An (thị xã Điện Bàn, Quảng Nam) phát hiện trưởng công an phường này tử vong tại nhà xe cơ quan. Lực lượng chức năng đang khám nghiệm để làm rõ nguyên nhân.",Thanh Đức,27/2/2023 08:24 (GMT+7)
6,Park Seo Joon cùng loạt ‘bảo chứng phòng vé’ tái xuất màn bạc 2023,https://zingnews.vn/park-seo-joon-cung-loat-bao-chung-phong-ve-tai-xuat-man-bac-2023-post1406694.html,https://znews-photo.zingcdn.me/w360/Uploaded/ofh_btgazsox/2023_02_25/f850x638_463364_540853_5050.jpg,GIẢI TRÍ,"2023 đánh dấu sự trở lại màn ảnh rộng của Park Seo Joon với loạt dự án bom tấn. Ngoài ra, nhiều cái tên ""bảo chứng phòng vé"" xứ Hàn cũng xác nhận tái xuất.   ",Linh Phương,27/2/2023 07:16 (GMT+7)
7,'Halo effect' khiến chúng ta tin một người ưa nhìn cũng sẽ thông minh,https://zingnews.vn/halo-effect-khien-chung-ta-tin-mot-nguoi-ua-nhin-cung-se-thong-minh-post1406974.html,https://znews-photo.zingcdn.me/w360/Uploaded/neg_esfjaex/2023_02_26/Thumb_2.jpg,,"Halo effect cũng có tác động nhất định trong môi trường giáo dục, nơi làm việc và được tận dụng để làm tiếp thị.",Thái An,27/2/2023 07:00 (GMT+7)
8,Dấu hiệu bạn đã nhiễm cúm A H5N1,https://zingnews.vn/dau-hieu-ban-da-nhiem-cum-a-h5n1-post1406908.html,https://znews-photo.zingcdn.me/w360/Uploaded/gtnvzv/2023_02_26/316570916fb3987076cece316cd744ee.jpg,SỨC KHỎE,Tôi được biết TP.HCM sẽ giám sát chặt người nhập cảnh đi ở vùng có dịch cúm A H5N1. Xin hỏi khi nhiễm bệnh này sẽ có những triệu chứng nào? Phòng bệnh ra sao?,Độc giả Thái Hòa,27/2/2023 07:00 (GMT+7)
9,Dọn dẹp thư mục lộn xộn nhất trên máy tính,https://zingnews.vn/don-dep-thu-muc-lon-xon-nhat-tren-may-tinh-post1406841.html,https://znews-photo.zingcdn.me/w360/Uploaded/pqmcbzwv/2023_02_26/Downloads_folder_1.jpeg,CÔNG NGHỆ,"Thư mục Downloads trên máy tính là nơi chứa hàng trăm, thậm chí hàng nghìn file thuộc nhiều định dạng, thể loại và mức dung lượng khác nhau. Đã đến lúc bạn cần dọn dẹp nó.",Nguyễn Hiếu,27/2/2023 06:38 (GMT+7)
10,Miền Bắc nắng hanh cả tuần,https://zingnews.vn/mien-bac-nang-hanh-ca-tuan-post1406907.html,https://znews-photo.zingcdn.me/w360/Uploaded/lce_qjlcv/2021_10_17/lanh_PT_thumb.jpg,XÃ HỘI,"Thời tiết miền Bắc duy trì nắng ráo và hanh khô trong một tuần tới. Nhiệt độ ban ngày tăng cao lên mức 23-25 độ C và giảm sâu xuống mức 15 độ C về đêm, sáng sớm.",Mỹ Hà,27/2/2023 06:00 (GMT+7)
11,"Trung Quốc muốn đảo ngược suy giảm dân số, hãy nhìn vào Thụy Điển",https://zingnews.vn/trung-quoc-muon-dao-nguoc-suy-giam-dan-so-hay-nhin-vao-thuy-dien-post1406918.html,https://znews-photo.zingcdn.me/w360/Uploaded/ovhunah/2023_02_26/2f77e4c4aeac4997976b1424703be190.jpg,THẾ GIỚI,"Giới chuyên gia nhận định các chính sách của chính phủ có thể ngăn tỷ lệ sinh lao dốc, song không thể đảo ngược thực trạng các ca sinh giảm dần ở những nước phát triển.",Trần Hoàng,
12,"Người đàn ông 35 tuổi hiến trái tim, da, thận, giác mạc cứu 6 người",https://zingnews.vn/nguoi-dan-ong-35-tuoi-hien-trai-tim-da-than-giac-mac-cuu-6-nguoi-post1406972.html,https://znews-photo.zingcdn.me/w360/Uploaded/gtnvzv/2023_02_26/ghep_tang_cho_ray_2_1.jpg,SỨC KHỎE,"Chứng kiến con trai không qua khỏi, mẹ của bệnh nhân 35 tuổi, trú tại An Giang, quyết định hiến tặng các tạng còn chức năng hoạt động của con để cứu sống những người khác.",Phương Anh,27/2/2023 05:30 (GMT+7)
13,"Inter ngã ngựa, Napoli tiến gần chức vô địch Serie A sau 33 năm",https://zingnews.vn/inter-nga-ngua-napoli-tien-gan-chuc-vo-dich-serie-a-sau-33-nam-post1406993.html,https://znews-photo.zingcdn.me/w360/Uploaded/natmzz/2023_02_26/2023_02_26T125307Z_1151946948_UP1EJ2Q0ZSG3H_RTRMADP_3_SOCCER_ITALY_BGN_INT_REPORT.JPG,THỂ THAO,"Tối 26/2 (giờ Hà Nội), Inter thua Bologna 0-1 và bị Napoli bỏ xa 18 điểm trên bảng xếp hạng Serie A sau 24 vòng đấu.",Tuấn Nguyên,26/2/2023 22:13 (GMT+7)
14,Bộ Nông nghiệp cảnh báo sau khi Campuchia có người tử vong vì H5N1,https://zingnews.vn/bo-nong-nghiep-canh-bao-sau-khi-campuchia-co-nguoi-tu-vong-vi-h5n1-post1406948.html,https://znews-photo.zingcdn.me/w360/Uploaded/rohuoct/2023_02_26/namkhanh.jpg,KINH DOANH,Bộ Nông nghiệp và Phát triển nông thôn vừa ra công điện khẩn sau khi truyền thông Campuchia cho biết đã phát hiện ca tử vong trên người do virus cúm gia cầm A/H5N1.,Minh Khánh,26/2/2023 19:59 (GMT+7)
15,Phản ứng của HLV Ten Hag khi được hỏi về Mbappe,https://zingnews.vn/phan-ung-cua-hlv-ten-hag-khi-duoc-hoi-ve-mbappe-post1406892.html,https://znews-photo.zingcdn.me/w360/Uploaded/natmzz/2023_02_26/2023_02_01T215646Z_1167426497_UP1EJ211OYKGZ_RTRMADP_3_SOCCER_ENGLAND_MUN_NTG_REPORT_1_.JPG,THỂ THAO,Nhà cầm quân sinh năm 1970 tỏ rõ sự bất ngờ với câu hỏi liên quan đến cầu thủ đang được định giá cao nhất thế giới.,Tuấn Nguyên,26/2/2023 17:40 (GMT+7)
16,Triết lý 'phản Italy' đưa Napoli bay cao,https://zingnews.vn/triet-ly-phan-italy-dua-napoli-bay-cao-post1406851.html,https://znews-photo.zingcdn.me/w360/Uploaded/yrfjpyvslyr/2023_02_26/2023_02_25T174616Z_1659718282_UP1EJ2P1DD2YI_RTRMADP_3_SOCCER_ITALY_EMP_NAP_REPORT.JPG,THỂ THAO,Napoli đang là CLB Italy chơi thứ bóng đá duy mỹ nhất trong nhiều năm qua. Và triết lý xuyên suốt thành công ấy lại đi ngược lại với truyền thống phòng ngự của xứ sở mỳ ống.,Duy Kiên,26/2/2023 16:40 (GMT+7)
17,Những người ở TP.HCM được lấy mẫu xét nghiệm cúm A H5N1,https://zingnews.vn/nhung-nguoi-o-tphcm-duoc-lay-mau-xet-nghiem-cum-a-h5n1-post1405908.html,https://znews-photo.zingcdn.me/w360/Uploaded/rotnrz/2023_02_17/tim_nicholson_bird_flu_1.jpg,SỨC KHỎE,"TP.HCM lo lắng nguy cơ xâm nhập của cúm A (H5N1) và cúm gia cầm khác thông qua các hoạt động vận chuyển, kinh doanh gia cầm trái phép.",Bích Huệ,26/2/2023 16:10 (GMT+7)
18,Gelex lên tiếng trước loạt tin đồn,https://zingnews.vn/gelex-len-tieng-truoc-loat-tin-don-post1406894.html,https://znews-photo.zingcdn.me/w360/Uploaded/rohuoct/2023_02_26/dsc01530_16773293148831832806342.jpg,KINH DOANH,Công ty CP Tập đoàn Gelex (GEX) vừa lên tiếng bác bỏ các thông tin thất thiệt thời gian qua và khuyến cáo nhà đầu tư thận trọng.,Minh Khánh,26/2/2023 14:04 (GMT+7)
19,Công thức bí ẩn tạo nên danh sách 'Sách bán chạy nhất',https://zingnews.vn/cong-thuc-bi-an-tao-nen-danh-sach-sach-ban-chay-nhat-post1406687.html,https://znews-photo.zingcdn.me/w360/Uploaded/kbvunao/2023_02_25/istockphoto_153773919_612x612.jpg,XUẤT BẢN,"Những người trong ngành xuất bản giải thích vì sao họ thấy khó chịu với danh sách sách bán chạy nhất của New York Times, hóa ra, danh sách này là một dự án dữ liệu đầy mâu thuẫn.",Thái Thanh,26/2/2023 13:18 (GMT+7)
20,Đề xuất cho chủ đầu tư thỏa thuận về quyền sử dụng đất với người dân,https://zingnews.vn/de-xuat-cho-chu-dau-tu-thoa-thuan-ve-quyen-su-dung-dat-voi-nguoi-dan-post1406838.html,https://znews-photo.zingcdn.me/w360/Uploaded/rohuoct/2023_02_26/1.jpg,KINH DOANH,"HoREA vừa gửi góp ý Dự thảo Luật Đất đai (sửa đổi), trong đó đề nghị một số vấn đề liên quan dự án công trình để phát triển kinh tế - xã hội vì lợi ích quốc gia, công cộng.",Minh Khánh,26/2/2023 11:42 (GMT+7)
21,Kỷ nguyên hack bằng trí tuệ nhân tạo đang đến gần,https://zingnews.vn/ky-nguyen-hack-bang-tri-tue-nhan-tao-dang-den-gan-post1405412.html,https://znews-photo.zingcdn.me/w360/Uploaded/cplahuo/2023_02_21/snatch_el_ransomware_que_reinicia_tu_pc_en_modo_seguro_y_se_salta_el_antivirus_redes_zone_portal_sobre_telecomunicaciones_y_redes.jpg,,Chúng ta cần chuẩn bị kỹ lưỡng để đối phó với mối hiểm họa tiềm tàng mới mang tên trí tuệ nhân tạo.,Việt Anh,
22,"Ngất xỉu trên đường, shipper vẫn bị khách hỏi về món ăn giao thiếu",https://zingnews.vn/ngat-xiu-tren-duong-shipper-van-bi-khach-hoi-ve-mon-an-giao-thieu-post1406769.html,https://znews-photo.zingcdn.me/w360/Uploaded/ovunhuo/2023_02_25/shipper3.jpg,ĐỜI SỐNG,"Một đôi vợ chồng sấn tới hỏi Mohamed về đơn hàng thiếu món thay vì quan tâm tình hình sức khỏe của anh. Khi bị đuổi đi, họ bước ngang người anh để quay về căn hộ cao cấp.",Hoàng Kỳ,26/2/2023 05:25 (GMT+7)
23,Son Na Eun rũ bỏ hình tượng ngây thơ,https://zingnews.vn/son-na-eun-ru-bo-hinh-tuong-ngay-tho-post1406772.html,https://znews-photo.zingcdn.me/w360/Uploaded/unhuuak/2023_02_25/273725808_284793940423158_883777739059197610_n_1.jpg,GIẢI TRÍ,"Son Na Eun là nữ thần tượng Hàn Quốc được khán giả yêu mến bởi vẻ ngoài ngọt ngào, ngây thơ. Sau khi chuyển hướng diễn xuất, cô xây dựng hình ảnh trưởng thành hơn.",Dạ Ngân,26/2/2023 00:21 (GMT+7)
24,Cái chết của thiên đường du lịch,https://zingnews.vn/cai-chet-cua-thien-duong-du-lich-post1406744.html,https://znews-photo.zingcdn.me/w360/Uploaded/ovunhuo/2023_02_25/shark2.jpg,ĐỜI SỐNG,New Caledonia (Australia) đã không còn là khu du lịch bình yên sau khi hàng loạt tai nạn do cá mập tấn công bị công khai.,Hoàng Kỳ,25/2/2023 21:09 (GMT+7)
25,Bộ Công an vào cuộc vụ dự án khu dân cư Tam Phước,https://zingnews.vn/bo-cong-an-vao-cuoc-vu-du-an-khu-dan-cu-tam-phuoc-post1406732.html,https://znews-photo.zingcdn.me/w360/Uploaded/neg_iflysfj/2023_02_25/tp_1677308840549.jpg,PHÁP LUẬT,"Ngày 25/2, Cơ quan CSĐT Bộ Công yêu cầu các đơn vị liên quan của tỉnh Đồng Nai cung cấp hồ sơ, tài liệu để điều tra vụ án dự án khu dân cư Tam Phước.",Anonymous,25/2/2023 20:58 (GMT+7)
26,Cận cảnh Ferrari Omologata độc nhất thế giới,https://zingnews.vn/can-canh-ferrari-omologata-doc-nhat-the-gioi-post1406685.html,https://znews-photo.zingcdn.me/w360/Uploaded/aobhuua/2023_02_25/Ferrari_Omologata_1.jpg,XE,"Được phát triển trên nền tảng 812 Superfast, siêu xe này được sản xuất dành riêng cho một khách hàng đặc biệt của Ferrari.",Việt Hà,25/2/2023 19:45 (GMT+7)
27,Chàng trai ngất xỉu vì thi chung phòng với 500 nữ sinh,https://zingnews.vn/chang-trai-ngat-xiu-vi-thi-chung-phong-voi-500-nu-sinh-post1406703.html,https://znews-photo.zingcdn.me/w360/Uploaded/ovunhuo/2023_02_25/india2.jpg,ĐỜI SỐNG,Một nam sinh 17 tuổi ở Ấn Độ đã bất tỉnh vì lo lắng khi phải ở trong phòng thi với 500 nữ sinh khác.,Hoàng Kỳ,25/2/2023 18:01 (GMT+7)
28,Cơ hội để Karius thoát khỏi vũng lầy,https://zingnews.vn/co-hoi-de-karius-thoat-khoi-vung-lay-post1406640.html,https://znews-photo.zingcdn.me/w360/Uploaded/mfnuy/2023_02_25/methode_times_prod_web_bin_a0efbdb8_a48d_11e8_bf09_48d84bc1dddb.jpg,THỂ THAO,Loris Karius chuẩn bị có trận ra mắt Newcastle trước MU sau khi trải qua thời gian dài ác mộng mắc sai lầm ở chung kết Champions League 2018.,Hiểu Phong,25/2/2023 18:01 (GMT+7)
29,TP.HCM khẩn trương phòng cúm A H5N1 xâm nhập,https://zingnews.vn/tphcm-khan-truong-phong-cum-a-h5n1-xam-nhap-post1406686.html,https://znews-photo.zingcdn.me/w360/Uploaded/mdf_reovdl/2023_02_25/bird_flu.jpg,SỨC KHỎE,"TP.HCM sẽ bắt đầu các biện pháp giám sát chặt người nhập cảnh đi đến, ở từ vùng có dịch cúm A H5N1.",Bích Huệ,25/2/2023 16:37 (GMT+7)
30,"HLV Shin Tae-yong thất vọng, không nói về mục tiêu ở U20 châu Á",https://zingnews.vn/hlv-shin-tae-yong-that-vong-khong-noi-ve-muc-tieu-o-u20-chau-a-post1406663.html,https://znews-photo.zingcdn.me/w360/Uploaded/zatmty/2023_02_25/63e65e24ac4d8_pelatih_timnas_indonesia_shin_tae_yong_1265_711.jpg,THỂ THAO,HLV người Hàn Quốc thể hiện rõ sự không hài lòng sau khi chốt danh sách 23 cầu thủ U20 Indonesia.,Nguyễn Sơn,25/2/2023 16:15 (GMT+7)
31,Động lực tình yêu của Luis Suarez,https://zingnews.vn/dong-luc-tinh-yeu-cua-luis-suarez-post1406001.html,https://znews-photo.zingcdn.me/w360/Uploaded/oplwkea/2023_02_23/20170123114818_1.jpg,THỂ THAO,"Luis Suarez biết yêu từ năm 15 tuổi. Người đó giờ là vợ và mẹ ba đứa con của anh. Nếu không có người đó, có thể đã không có một cầu thủ lớn Luis Suarez sau này.",Chính Phong,25/2/2023 16:00 (GMT+7)
32,"So sánh sự cố tài liệu mật giữa ông Trump, ông Biden và ông Pence",https://zingnews.vn/so-sanh-su-co-tai-lieu-mat-giua-ong-trump-ong-biden-va-ong-pence-post1400903.html,https://znews-photo.zingcdn.me/w360/Uploaded/rotntv/2023_02_11/RST_D_B_Pv1.jpg,,"Việc tài liệu mật xuất hiện ở nhà hay văn phòng của ông Biden, ông Pence và ông Trump khiến nhiều người đặt lên bàn cân so sánh sự cố liên quan tới 3 chính trị gia Mỹ này.",Phương Linh,25/2/2023 16:00 (GMT+7)
33,Nữ giới nên tự chủ chi tiêu dù kiếm nhiều hay ít,https://zingnews.vn/nu-gioi-nen-tu-chu-chi-tieu-du-kiem-nhieu-hay-it-post1402773.html,https://znews-photo.zingcdn.me/w360/Uploaded/ovunhuo/2023_02_17/Frame_112.jpg,,"Không ít phụ nữ cho phép bạn trai hoặc chồng toàn quyền kiểm soát chi tiêu. Thực chất, hành động này chỉ khiến họ gặp bất lợi thay vì giúp mối quan hệ ổn định hơn.",,
34,Biến động của Miss Universe,https://zingnews.vn/bien-dong-cua-miss-universe-post1406474.html,https://znews-photo.zingcdn.me/w360/Uploaded/neg_yslewlx/2023_02_24/Donald_Trump_hp_GQ_03Nov15_rex_b.jpg,GIẢI TRÍ,"Những lời bàn tán dù theo hướng nào, cũng đã và đang khiến cho cái tên Miss Universe trở nên hấp dẫn hơn bao giờ hết.",Quốc Minh,25/2/2023 09:31 (GMT+7)
35,Tài sản tăng gấp 4 lần sau kết hôn,https://zingnews.vn/tai-san-tang-gap-4-lan-sau-ket-hon-post1406519.html,https://znews-photo.zingcdn.me/w360/Uploaded/mdf_drkydd/2023_02_24/z4135883044904_cf8ec1488a06e38d1b36d62b74cc351b_1.jpg,ĐỜI SỐNG,Các cặp vợ chồng sở hữu khối tài sản gấp 4 lần so với những đôi sống cùng nhau nhưng chưa kết hôn. Nghiên cứu chỉ ra vài nguyên nhân tạo ra khoảng cách này.,Thùy Trang,25/2/2023 09:15 (GMT+7)
36,Người báo hiếu tiếng Việt qua thơ và tác phẩm dịch,https://zingnews.vn/nha-tho-dich-gia-duong-tuong-mot-doi-an-nam-voi-chu-post1406560.html,https://znews-photo.zingcdn.me/w360/Uploaded/bpivpbbx/2023_02_25/duongtuong.jpg,XUẤT BẢN,"Với nhiều đóng góp cho nền văn học Việt Nam trong hơn 60 năm, nhà thơ, dịch giả Dương Tường đã dấn thân cả đời cho văn học trong cả sáng tác thơ ca và dịch thuật.",Thanh Trần,25/2/2023 08:44 (GMT+7)
37,3 kiểu vi phạm bản quyền thương hiệu phổ biến,https://zingnews.vn/3-kieu-vi-pham-ban-quyen-thuong-hieu-pho-bien-post1406456.html,https://znews-photo.zingcdn.me/w360/Uploaded/neg_esfjaex/2023_02_24/Thumb_4.jpg,,"Tại Mỹ, hành động vi phạm bản quyền thương hiệu được cho là bất hợp pháp vì vi phạm luật nhãn hiệu.",Thái An,25/2/2023 07:00 (GMT+7)
38,Những mẫu xe cũ đang tăng giá bán tại Việt Nam,https://zingnews.vn/nhung-mau-xe-cu-dang-tang-gia-ban-tai-viet-nam-post1406071.html,https://znews-photo.zingcdn.me/w360/Uploaded/yqdlmdxwp/2023_01_05/Toyota_Innova_G_2020_Zing_1_.jpg,XE,"Ford Ranger, Toyota Innova hay Hyundai Grand i10 đều là những mẫu xe nhận mức tăng giá trên thị trường thứ cấp, dao động 10-22% tùy năm sản xuất.",Đan Thanh,25/2/2023 07:00 (GMT+7)
39,Sharapova với người tình ích kỷ,https://zingnews.vn/sharapova-voi-nguoi-tinh-ich-ky-post1402368.html,https://znews-photo.zingcdn.me/w360/Uploaded/oplwkea/2023_02_16/4f394ed9ecad044a3e000001.jpg,THỂ THAO,"Trong nhiều tháng, tôi chờ đợi một dấu hiệu nào đó từ anh ấy, một gợi ý nào đó. Bây giờ tôi đã có. Chỉ trong một câu. Mối quan hệ của chúng tôi đã kết thúc.",Chính Phong,25/2/2023 05:30 (GMT+7)
40,WHO lo ngại sau cái chết vì H5N1 của bé gái ở Campuchia,https://zingnews.vn/who-lo-ngai-sau-cai-chet-vi-h5n1-cua-be-gai-o-campuchia-post1406527.html,https://znews-photo.zingcdn.me/w360/Uploaded/rotnrz/2023_02_24/cum_gia_cam_bung_phat_1.jpg,SỨC KHỎE,"WHO cho biết các báo cáo ngày càng tăng về những trường hợp cúm gia cầm H5N1 ở người là ""đáng lo ngại"".",Linh Thùy,25/2/2023 05:28 (GMT+7)
41,Tìm thấy nghi phạm giết cha trên LinkedIn,https://zingnews.vn/tim-thay-nghi-pham-giet-cha-tren-linkedin-post1406531.html,https://znews-photo.zingcdn.me/w360/Uploaded/ofh_btgazspf/2023_02_24/photo_1616469829581_73993eb86b02.jpg,ĐỜI SỐNG,"15 năm sau cái chết của cha mình, Maham Amjad (Pakistan) đã lần theo dấu vết của nghi phạm sang Dubai và tìm ra hắn.",Đinh Phạm,25/2/2023 00:04 (GMT+7)
42,Tiết lộ mới về chiếc hộp được đưa về tư dinh của ông Trump,https://zingnews.vn/tiet-lo-moi-ve-chiec-hop-duoc-dua-ve-tu-dinh-cua-ong-trump-post1406393.html,https://znews-photo.zingcdn.me/w360/Uploaded/liqpwivo/2023_02_24/classified_trump_thumb.JPG,THẾ GIỚI,Trợ lý của ông Donald Trump được cho là đã di chuyển một số tài liệu mật từ văn phòng chính phủ ở Palm Beach về tư dinh của cựu tổng thống ở Mar-a-Lago sau đợt khám xét của FBI.,Đại Hoàng,25/2/2023 00:00 (GMT+7)
43,"Campuchia có người chết do H5N1, Viện Pasteur TP.HCM chỉ đạo khẩn",https://zingnews.vn/campuchia-co-nguoi-chet-do-h5n1-vien-pasteur-tphcm-chi-dao-khan-post1406507.html,https://znews-photo.zingcdn.me/w360/Uploaded/uohusah/2023_02_24/gia_cam.jpg,XÃ HỘI,"Sau khi Campuchia ghi nhận một trường hợp tử vong do dương tính với cúm gia cầm A (H5N1), Viện Pasteur TP.HCM đã có công văn gửi giám đốc sở y tế 20 tỉnh thành phía Nam.",Anh Nhàn,24/2/2023 22:27 (GMT+7)
44,Bắt tạm giam thanh niên dàn cảnh cùng bạn gái cướp tài sản,https://zingnews.vn/bat-tam-giam-thanh-nien-dan-canh-cung-ban-gai-cuop-tai-san-post1406354.html,https://znews-photo.zingcdn.me/w360/Uploaded/pwivovlb/2021_09_13/anh4_1.jpg,PHÁP LUẬT,"Công an huyện Định Quán (tỉnh Đồng Nai) đã ra quyết định khởi tố vụ án hình sự, khởi tố bị can, bắt tạm giam Nguyễn Xuân Chiến (19 tuổi) để điều tra làm rõ hành vi cướp tài sản.",Anonymous,24/2/2023 22:24 (GMT+7)
45,Louis Vuitton bị cáo buộc vi phạm bản quyền,https://zingnews.vn/louis-vuitton-bi-cao-buoc-vi-pham-ban-quyen-post1406481.html,https://znews-photo.zingcdn.me/w360/Uploaded/izdmy/2023_02_24/z4135278873676_2f584c4a7cb2c30729eb51b133909e9e_1.jpg,THỜI TRANG SAO,Quỹ từ thiện của Joan Mitchell cho rằng Louis Vuitton đã vi phạm bản quyền khi sử dụng trái phép tranh của nữ họa sĩ người Mỹ.,Huỳnh Duy,24/2/2023 21:39 (GMT+7)
46,"Nhà thơ, dịch giả Dương Tường qua đời",https://zingnews.vn/nha-tho-dich-gia-duong-tuong-qua-doi-post1406500.html,https://znews-photo.zingcdn.me/w360/Uploaded/bpcpwiq2/2023_02_24/Duong_Tuong_1.jpg,XUẤT BẢN,"Nhà thơ, dịch giả gạo cội của văn chương Việt qua đời vào hồi 20h08 ngày 24/2, hưởng thọ 92 tuổi.",Thiên Ái,24/2/2023 21:19 (GMT+7)
47,Bóng đá Italy trỗi dậy ở cúp châu Âu mùa này,https://zingnews.vn/bong-da-italy-troi-day-o-cup-chau-au-mua-nay-post1406426.html,https://znews-photo.zingcdn.me/w360/Uploaded/bpivpawv/2023_02_24/2023_02_22T220023Z_250576477_UP1EJ2M1P4M32_RTRMADP_3_SOCCER_CHAMPIONS_INT_POR_REPORT.JPG,THỂ THAO,"Bất chấp những khó khăn về tài chính, các đại diện từ Serie A vẫn thể hiện phong độ ấn tượng ở Champions League, Europa League hay Conference League 2022/23.",Hồng An,24/2/2023 19:30 (GMT+7)
48,Thành triệu phú nhờ sở thích thời đại học,https://zingnews.vn/thanh-trieu-phu-nho-so-thich-thoi-dai-hoc-post1406465.html,https://znews-photo.zingcdn.me/w360/Uploaded/ofh_btgazspf/2023_02_24/z4135141838670_334298e8d3e56d03a6e71e1a4f899e0a_1.jpg,ĐỜI SỐNG,"Bắt đầu chụp ảnh cho bạn bè để giải trí, Katelyn Alsop (Mỹ) đã biến sở thích đó thành công việc kinh doanh triệu đô.",Đinh Phạm,24/2/2023 19:30 (GMT+7)
49,Dàn sao Napoli thành hàng hot trên thị trường chuyển nhượng,https://zingnews.vn/dan-sao-napoli-thanh-hang-hot-tren-thi-truong-chuyen-nhuong-post1406196.html,https://znews-photo.zingcdn.me/w360/Uploaded/qxjrcqjwq/2023_02_24/thumb_napoli.jpg,THỂ THAO,"Kỳ chuyển nhượng hè 2023 còn hơn 4 tháng mới mở cửa, song Osimhen và Kvaratskhelia đang được một loạt CLB lớn săn đón.",Thanh Phong,24/2/2023 19:00 (GMT+7)
50,8 điều cha mẹ cần biết về bệnh thủy đậu,https://zingnews.vn/8-dieu-cha-me-can-biet-ve-benh-thuy-dau-post1405910.html,https://znews-photo.zingcdn.me/w360/Uploaded/rotnrz/2023_02_17/image_20160804_12207_1flp6oj_1.jpg,SỨC KHỎE,Hầu hết trẻ em đều mắc thủy đậu một lần trong đời. Căn bệnh này rất dễ lây lan.,Nguyên Lê,24/2/2023 18:51 (GMT+7)
51,Man United lại gặp đối thủ La Liga ở Europa League,https://zingnews.vn/man-united-lai-gap-doi-thu-la-liga-o-europa-league-post1406427.html,https://znews-photo.zingcdn.me/w360/Uploaded/natmzz/2023_02_24/2023_02_23T221224Z_1048245414_UP1EJ2N1OXWN5_RTRMADP_3_SOCCER_EUROPA_MUN_FCB_REPORT.JPG,THỂ THAO,Lá thăm may rủi đưa MU chạm trán Betis ở vòng 16 đội Europa League 2022/23.,Tuấn Nguyên,24/2/2023 17:07 (GMT+7)
52,"Hyundai Grand i10 2024 chạy thử trên đường, thay đổi kiểu dáng",https://zingnews.vn/hyundai-grand-i10-2024-chay-thu-tren-duong-thay-doi-kieu-dang-post1406289.html,https://znews-photo.zingcdn.me/w360/Uploaded/dqvpxpck/2023_02_24/2024_hyundai_i10_front_view_spy_photo.jpg,XE,Nhiều trang bị bên ngoài của Grand i10 phiên bản mới được nâng cấp. Động cơ trên xe khả năng cao không có thay đổi so với phiên bản hiện tại.,Thanh Nhã,24/2/2023 14:23 (GMT+7)
53,Ý nghĩa món bánh chia tay ở Hong Kong,https://zingnews.vn/y-nghia-mon-banh-chia-tay-o-hong-kong-post1406092.html,https://znews-photo.zingcdn.me/w360/Uploaded/ayhunwa/2023_02_23/331263348_1176973129673505_7314502429639544404_n.jpg,DU LỊCH,"Bánh chia tay dành cho đồng nghiệp vào ngày làm việc cuối, ngụ ý lời cảm ơn cho sự cống hiến, chăm chỉ và tình bạn đẹp đẽ tại môi trường công sở ở Hong Kong (Trung Quốc).",Thảo Linh,24/2/2023 14:23 (GMT+7)
