id,title,link,image,tag,preview,author,timestamp
431,Đà Lạt xử phạt chủ khách sạn có thái độ phân biệt đối xử với du khách,https://zingnews.vn/da-lat-xu-phat-chu-khach-san-co-thai-do-phan-biet-doi-xu-voi-du-khach-post1398104.html,https://znews-photo.zingcdn.me/w360/Uploaded/nugzrd/2023_02_01/IMG_20230201_184242.jpg,DU LỊCH,Chủ khách sạn Dream Flower Hotel ở Đà Lạt bị xử phạt 4 triệu đồng vì đã phân biệt đối xử với khách du lịch khi đến thuê phòng.,Minh An,1/2/2023 19:02 (GMT+7)
432,Người đàn ông bị đâm tử vong trong căn nhà ở TP.HCM,https://zingnews.vn/nguoi-dan-ong-bi-dam-tu-vong-trong-can-nha-o-tphcm-post1398103.html,https://znews-photo.zingcdn.me/w360/Uploaded/zxgorz/2023_02_01/an_mang_binh_tan.jpg,PHÁP LUẬT,"Sau khi bị đâm, người đàn ông 49 tuổi được đưa đến bệnh viện cấp cứu nhưng không qua khỏi. Cảnh sát đã bắt giữ một nghi phạm liên quan vụ án mạng.",Lê Trai,1/2/2023 18:46 (GMT+7)
433,Sách mở rộng tư duy quản lý,https://zingnews.vn/sach-mo-rong-tu-duy-quan-ly-post1397864.html,https://znews-photo.zingcdn.me/w360/Uploaded/ofh_btgazspf/2023_01_31/Remote_Mockup_Book_1.jpg,ĐỜI SỐNG,"Một người làm quản lý cần có kỹ năng nắm bắt tâm lý, mạnh mẽ và sáng tạo trong điều hành cấp dưới của mình.",Đinh Phạm,1/2/2023 18:14 (GMT+7)
434,Những CLB mạnh nhất thế giới hiện tại,https://zingnews.vn/nhung-clb-manh-nhat-the-gioi-hien-tai-post1398037.html,https://znews-photo.zingcdn.me/w360/Uploaded/bpivpawv/2023_02_01/maxresdefault.jpg,THỂ THAO,Mô hình thống kê của Opta chỉ ra Bayern Munich đang là CLB có thực lực mạnh nhất thế giới tính đến hết tháng 1/2023.,Hồng An,1/2/2023 17:36 (GMT+7)
435,"Cá cảnh biết chơi game, lấy tiền của chủ mua phụ kiện",https://zingnews.vn/ca-canh-biet-choi-game-lay-tien-cua-chu-mua-phu-kien-post1398061.html,https://znews-photo.zingcdn.me/w360/Uploaded/spluaaa/2023_02_01/230127035336_01_ninento_switch_fish_japan_screengrab.jpg,CÔNG NGHỆ,"Sự cố bất ngờ xảy ra trên sóng livestream ghi lại cảnh chú cá hồn nhiên đổi tên tài khoản, avatar, thanh toán mua game, tải game bằng tay cầm Nintendo Switch.",Thúy Liên,1/2/2023 17:35 (GMT+7)
436,FIFA muốn lập kỷ lục trong ngày khai mạc World Cup 2023,https://zingnews.vn/fifa-muon-lap-ky-luc-trong-ngay-khai-mac-world-cup-2023-post1398014.html,https://znews-photo.zingcdn.me/w360/Uploaded/bpivpawv/2023_02_01/2023_FIFA_Women_s_World_Cup_debutantes_graphic_1.jpg,THỂ THAO,Liên đoàn Bóng đá Thế giới (FIFA) chuyển địa điểm tổ chức trận đầu tiên của World Cup 2023 với kỳ vọng tạo ra lễ khai mạc chưa từng thấy trong lịch sử.,Hồng An,1/2/2023 17:27 (GMT+7)
437,'Cuộc chiến cà phê' khốc liệt ở Hàn Quốc,https://zingnews.vn/cuoc-chien-ca-phe-khoc-liet-o-han-quoc-post1397972.html,https://znews-photo.zingcdn.me/w360/Uploaded/mrndcqjwq/2023_02_01/koreancafes2.jpg,KINH DOANH,"Tính đến cuối năm 2022, có gần 99.000 quán cà phê ở Hàn Quốc. Trung bình, mỗi ngày có 6 quán đóng cửa vì không thể cạnh tranh với các quán mới mở.",Diệu Thanh,1/2/2023 15:00 (GMT+7)
438,Những phân khúc ôtô hứa hẹn bùng nổ năm 2023,https://zingnews.vn/nhung-phan-khuc-oto-hua-hen-bung-no-nam-2023-post1397359.html,https://znews-photo.zingcdn.me/w360/Uploaded/yqdlmdxwp/2022_08_24/Veloz_Xpander_zing.jpg,,Phân khúc SUV đô thị cỡ nhỏ và MPV giá rẻ được dự đoán sẽ tiếp tục bùng nổ sau khi có doanh số tăng trưởng ổn định và thu hút lượng lớn khách hàng trong năm 2023.,Đan Thanh,
439,10 loại thực phẩm giàu carbs không làm bạn tăng cân,https://zingnews.vn/10-loai-thuc-pham-giau-carbs-khong-lam-ban-tang-can-post1397528.html,https://znews-photo.zingcdn.me/w360/Uploaded/yqdxwpcww/2023_01_30/apples_and_pears.jpg,SỨC KHỎE,"Nhiều chuyên gia dinh dưỡng cho rằng nếu muốn giảm cân, mọi người có thể ăn những thực phẩm giàu carb như bánh mì, khoai lang, táo, lê.",,
440,Bac A Bank chào bán hơn 25 triệu trái phiếu đợt 2,https://zingnews.vn/bac-a-bank-chao-ban-hon-25-trieu-trai-phieu-dot-2-post1397813.html,https://znews-photo.zingcdn.me/w360/Uploaded/wyhktpu/2023_01_31/NKQ_2687_1_.jpg,KINH DOANH,"Với mục tiêu đa dạng danh mục đầu tư và tối ưu lợi ích khách hàng, Ngân hàng TMCP Bắc Á (Bac A Bank) tiếp tục chào bán 25,646 triệu trái phiếu từ 30/1 đến 27/2.",Thanh Trà,1/2/2023 10:00 (GMT+7)
441,Hàng tồn kho của Novaland trị giá gần 135.000 tỷ đồng,https://zingnews.vn/hang-ton-kho-cua-novaland-tri-gia-gan-135000-ty-dong-post1397930.html,https://znews-photo.zingcdn.me/w360/Uploaded/mzdqa/2023_02_01/novaland_novaphanthiet_nvl_1.jpg,KINH DOANH,Biến động bất lợi từ thị trường bất động sản khiến doanh thu và lợi nhuận của Novaland đều giảm mạnh trong năm 2022. Lượng hàng tồn kho của doanh nghiệp đạt gần 135.000 tỷ đồng.,Huy Lê,1/2/2023 09:26 (GMT+7)
442,Nữ diễn viên 4 lần đóng bom tấn tỷ USD,https://zingnews.vn/nu-dien-vien-4-lan-dong-bom-tan-ty-usd-post1397825.html,https://znews-photo.zingcdn.me/w360/Uploaded/rohunaa/2023_01_31/avatar_2_zoe_saldana_1024x538.jpg,PHIM ẢNH,"Zoe Saldana trở thành diễn viên đầu tiên trong lịch sử dắt túi 4 siêu bom tấn thương mại bao gồm ""Avatar"", ""Infinity War"", ""Endgame"" và ""Avatar 2"".",,
443,Cuộc săn lùng những tòa nhà xấu nhất tại Trung Quốc,https://zingnews.vn/cuoc-san-lung-nhung-toa-nha-xau-nhat-tai-trung-quoc-post1397871.html,https://znews-photo.zingcdn.me/w360/Uploaded/ovunhuo/2023_01_31/ugly1.jpg,ĐỜI SỐNG,"Thông qua bình chọn, các kiến trúc sư tại xứ tỷ dân mong muốn cải thiện kiến trúc đô thị. Tuy nhiên, một bộ phận công chúng lo ngại về tính công bằng và chuyên nghiệp của cuộc thi.",Hoàng Kỳ,1/2/2023 07:25 (GMT+7)
444,Studentification - sự thay đổi ở những nơi có đông sinh viên sinh sống,https://zingnews.vn/studentification-su-thay-doi-o-nhung-noi-co-dong-sinh-vien-sinh-song-post1397811.html,https://znews-photo.zingcdn.me/w360/Uploaded/neg_esfjaex/2023_01_31/Thumb_4.jpg,,Studentification thường được cho là một khái niệm tiêu cực nhưng một tiến sĩ tin rằng quá trình này có thể tạo ra sự thay đổi tích cực nếu có kế hoạch phù hợp.,Thái An,1/2/2023 07:00 (GMT+7)
445,Xung đột tài trợ của bóng đá thế giới,https://zingnews.vn/xung-dot-tai-tro-cua-bong-da-the-gioi-post1397842.html,https://znews-photo.zingcdn.me/w360/Uploaded/zyxx/2023_01_31/1223096922.jpeg,KINH DOANH,Mâu thuẫn giữa doanh nghiệp tài trợ và đội bóng luôn tồn tại ở mọi giải đấu. Nhiều nhãn hàng đã dừng hợp tác với câu lạc bộ khi các điều kiện về lợi ích không còn được đảm bảo.,Thanh Vũ,1/2/2023 07:00 (GMT+7)
446,Những chất béo giúp bạn giảm cân lành mạnh,https://zingnews.vn/nhung-chat-beo-giup-ban-giam-can-lanh-manh-post1397532.html,https://znews-photo.zingcdn.me/w360/Uploaded/lert/2023_01_30/Avocado_Almonds_scaled_1.jpg,SỨC KHỎE,"Nhiều người chọn loại bỏ hoàn toàn chất béo khỏi thực đơn khi giảm cân. Tuy nhiên, quả bơ, dầu olive và hạnh nhân cung cấp chất béo tốt, hỗ trợ quá trình giảm cân.",,
447,"Hàn Quốc càn quét nghệ sĩ, vận động viên trốn nhập ngũ",https://zingnews.vn/han-quoc-can-quet-nghe-si-van-dong-vien-tron-nhap-ngu-post1397826.html,https://znews-photo.zingcdn.me/w360/Uploaded/qfssu/2023_01_31/1011947326_song_duk_ho_1993_p01_1280_720_1_1.jpg,GIẢI TRÍ,"Truyền thông Hàn Quốc đưa tin chính phủ nước này đang tiến hành cuộc điều tra quy mô lớn với những nghệ sĩ, vận động viên bị nghi ngờ làm giả hồ sơ khám nghĩa vụ quân sự.",Minh Hạo,31/1/2023 20:30 (GMT+7)
448,Kỹ sư Google bị đuổi việc khi đang chịu tang mẹ,https://zingnews.vn/ky-su-google-bi-duoi-viec-khi-dang-chiu-tang-me-post1397771.html,https://znews-photo.zingcdn.me/w360/Uploaded/ovunhuo/2023_01_31/google3.jpg,ĐỜI SỐNG,"Theo York, cơn bão cắt giảm nhân sự như một ""cú tát trời giáng"" vào nhóm kỹ sư IT đã cống hiến cho gã khổng lồ công nghệ.",Hoàng Kỳ,31/1/2023 19:50 (GMT+7)
449,"Nhiều nhà hàng ở TP.HCM, Hà Nội 'chạy đua' tiệc đầu năm",https://zingnews.vn/nhieu-nha-hang-o-tphcm-ha-noi-chay-dua-tiec-dau-nam-post1397760.html,https://znews-photo.zingcdn.me/w360/Uploaded/bzqvpdlu/2022_12_12/DSC_4234.jpeg,ĐỜI SỐNG,"Vừa hết Tết, nhiều quán ăn, nhà hàng lập tức phải đáp ứng nhu cầu tổ chức tiệc tân niên trong tuần đầu tiên dân văn phòng đi làm trở lại.",,
450,Liên tiếp ca nhập viện vì căn bệnh có thể gây đột tử ở người khỏe mạnh,https://zingnews.vn/lien-tiep-ca-nhap-vien-vi-can-benh-co-the-gay-dot-tu-o-nguoi-khoe-manh-post1397746.html,https://znews-photo.zingcdn.me/w360/Uploaded/gtnvzv/2023_01_31/IMG_0424_1024x768_1.jpg,SỨC KHỎE,"Chỉ trong một tuần, Bệnh viện Hữu nghị Việt Đức tiếp nhận 10 ca lóc động mạch chủ. Đây là bệnh lý ngoại khoa nguy hiểm, có thể dẫn tới tử vong nhanh.",Phương Anh,31/1/2023 16:56 (GMT+7)
451,"Hồ Ca kết hôn, có con",https://zingnews.vn/ho-ca-ket-hon-co-con-post1397733.html,https://znews-photo.zingcdn.me/w360/Uploaded/ycgvppwi/2023_01_31/icSd9kbwta4i1bSbMtNt6vGdq68eoqNlruAny67gJ8s.jpg,GIẢI TRÍ,"Nam diễn viên cho biết vợ anh là người ngoài ngành giải trí. Vì vậy, tài tử không chia sẻ danh tính lẫn hình ảnh để bảo vệ cô và con gái.",Di Hy,31/1/2023 15:44 (GMT+7)
452,Nhãn hàng quảng cáo cho HAGL mạnh cỡ nào,https://zingnews.vn/nhan-hang-quang-cao-cho-hagl-manh-co-nao-post1397671.html,https://znews-photo.zingcdn.me/w360/Uploaded/ofh_huqfztmf/2023_01_31/hagl_1_zing.jpg,THỂ THAO,Carabao không phải nhà tài trợ tầm thường và thực tế đã đi những bước rất khôn ngoan để tiếp cận với tệp khách hàng có sức mua mạnh thông qua bóng đá.,Nhật Anh,31/1/2023 14:11 (GMT+7)
453,Có ai 'biết ông Thương không?',https://zingnews.vn/co-ai-biet-ong-thuong-khong-post1397424.html,https://znews-photo.zingcdn.me/w360/Uploaded/aeixrdbkxq/2023_01_30/Frame_20.jpg,LIFESTYLE,"""Ông Thương"" trở thành nhân vật được nhiều Gen Z thắc mắc, tò mò về danh tính trong thời gian gần đây.",,
454,18 dự án căn hộ ở TP.HCM dự kiến mở bán năm nay,https://zingnews.vn/18-du-an-can-ho-o-tphcm-du-kien-mo-ban-nam-nay-post1396970.html,https://znews-photo.zingcdn.me/w360/Uploaded/rgtgtn/2022_03_21/Du_an_Swiss_Belresidences_Upper_East_Saigon_Copy.jpg,KINH DOANH,"Nguồn cung căn hộ mới ở TP.HCM được dự đoán tiếp tục sụt giảm, với 18 dự án chào bán chưa đến 20.000 căn hộ. Lượng tiêu thụ ước tính cũng chỉ rơi vào khoảng trên dưới 20%.",Lan Anh,31/1/2023 08:00 (GMT+7)
455,Dùng điện thoại nhiều có khiến bạn mắc 'ringxiety'?,https://zingnews.vn/dung-dien-thoai-nhieu-co-khien-ban-mac-ringxiety-post1397533.html,https://znews-photo.zingcdn.me/w360/Uploaded/neg_esfjaex/2023_01_30/Thumb_1.jpg,,Ringxiety được ví như hội chứng tay chân ma - tình trạng tâm lý khiến những người cụt chi vẫn cảm nhận được cơn đau giống như tay chân vẫn còn tồn tại.,Thái An,31/1/2023 07:37 (GMT+7)
456,Lý do thông báo tái hôn của Song Joong Ki bùng nổ mạng xã hội,https://zingnews.vn/ly-do-thong-bao-tai-hon-cua-song-joong-ki-bung-no-mang-xa-hoi-post1397584.html,https://znews-photo.zingcdn.me/w360/Uploaded/qfssu/2023_01_10/ghda.jpg,GIẢI TRÍ,"Song Joong Ki là ngôi sao hàng đầu tại Hàn Quốc và có thu nhập cao. Do đó, mọi động thái, đặc biệt chuyện riêng tư của anh luôn được chú ý.",,
457,Mbappe xuýt xoa trước kỹ năng đá phạt của Neymar,https://zingnews.vn/mbappe-xuyt-xoa-truoc-ky-nang-da-phat-cua-neymar-post1397600.html,https://znews-photo.zingcdn.me/w360/Uploaded/natmzz/2023_01_31/Untitled1.jpg,THỂ THAO,Tiền đạo sinh năm 1998 có biểu cảm hài hước trước pha đá phạt đẹp mắt của Neymar ở trận gặp Reims rạng sáng 30/1 (giờ Hà Nội).,Tuấn Nguyên,31/1/2023 05:28 (GMT+7)
458,Pep không tha thứ cho kẻ nổi loạn ở Man City,https://zingnews.vn/pep-khong-tha-thu-cho-ke-noi-loan-o-man-city-post1397607.html,https://znews-photo.zingcdn.me/w360/Uploaded/bpivpawv/2023_01_30/cancelo2.jpg,THỂ THAO,Pep Guardiola tiếp tục trung thành với nguyên tắc của mình khi tạo ra thương vụ chuyển nhượng gây ngạc nhiên ở phiên chợ tháng 1/2023.,Tường Linh,31/1/2023 05:17 (GMT+7)
459,Phát hiện bé gái sơ sinh bị bỏ rơi trước cổng nhà dân,https://zingnews.vn/phat-hien-be-gai-so-sinh-bi-bo-roi-truoc-cong-nha-dan-post1393910.html,https://znews-photo.zingcdn.me/w360/Uploaded/gtnzna/2023_01_13/sinh.jpg,XÃ HỘI,"Bé gái sơ sinh khoảng 2 tuần tuổi bị bỏ rơi trước cổng nhà dân cùng mảnh giấy viết bằng tay với nội dung: ""Do hoàn cảnh không nuôi được bé... muốn gửi gắm nuôi hộ"".",Anonymous,30/1/2023 21:51 (GMT+7)
460,"Xe chở hàng tạp hóa bất ngờ lao xuống vực, tài xế tử vong",https://zingnews.vn/xe-cho-hang-tap-hoa-bat-ngo-lao-xuong-vuc-tai-xe-tu-vong-post1393911.html,https://znews-photo.zingcdn.me/w360/Uploaded/gtnzna/2023_01_13/tainnan.jpeg,XÃ HỘI,"Chiếc xe tải chở hàng tạp hóa đang chuẩn bị vào kho hàng thì bất ngờ lao xuống vực sâu, khiến tài xế tử vong.",Anonymous,30/1/2023 21:44 (GMT+7)
461,"Ra hồ thả lưới bị lật thuyền, một người tử vong",https://zingnews.vn/ra-ho-tha-luoi-bi-lat-thuyen-mot-nguoi-tu-vong-post1393912.html,https://znews-photo.zingcdn.me/w360/Uploaded/gtnzna/2023_01_13/tn.jpeg,XÃ HỘI,"Trong lúc ra hồ đánh lưới nhưng bị lật thuyền, một người đàn ông ở Đắk Lắk rơi xuống nước, tử vong.",Anonymous,30/1/2023 20:59 (GMT+7)
462,Inter muốn giải cứu Maguire,https://zingnews.vn/inter-muon-giai-cuu-maguire-post1397561.html,https://znews-photo.zingcdn.me/w360/Uploaded/bpivpawv/2023_01_30/Maguire.JPG,THỂ THAO,Harry Maguire có thể là cái tên tiếp theo của Manchester United chuyển sang Inter Milan với hy vọng tìm lại phong độ đỉnh cao sự nghiệp.,Hồng An,30/1/2023 20:57 (GMT+7)
463,Mourinho bắt học trò chụp hình tập thể sau trận thua,https://zingnews.vn/mourinho-bat-hoc-tro-chup-hinh-tap-the-sau-tran-thua-post1397547.html,https://znews-photo.zingcdn.me/w360/Uploaded/natmzz/2023_01_30/a1.JPG,THỂ THAO,Cầu thủ Roma cùng HLV Mourinho chụp hình lưu niệm trong phòng thay đồ dù vừa thua Napoli 1-2 ở vòng 20 Serie A rạng sáng 30/1 (giờ Hà Nội).,Tuấn Nguyên,30/1/2023 19:28 (GMT+7)
464,Tài sản của Ngô Kinh,https://zingnews.vn/tai-san-cua-ngo-kinh-post1397284.html,https://znews-photo.zingcdn.me/w360/Uploaded/ycgvppwi/2023_01_29/56843821_4067654168209d95_2923623090661359616_n.jpg,GIẢI TRÍ,"Ngô Kinh từng chật vật tìm hào quang, nhận cát-xê bình dân ở showbiz. Sau nhiều nỗ lực phát triển, anh hiện là một trong những diễn viên có thu nhập cao nhất Trung Quốc.",Di Hy,30/1/2023 18:11 (GMT+7)
465,Sáng tạo mâm cúng ngày vía Thần Tài,https://zingnews.vn/sang-tao-mam-cung-ngay-via-than-tai-post1397415.html,https://znews-photo.zingcdn.me/w360/Uploaded/divspivp/2023_01_30/117299547_2047158495419454_1197653113781164652_n.jpg,ẨM THỰC,"Ngoài bộ tam sên, nhiều gia đình còn tự tay chuẩn bị thêm nhiều loại lễ vật có tạo hình bắt mắt cho mâm cúng ngày vía Thần Tài.",,
466,Bé gái 3 tuổi mắc bệnh lý xoắn dạ dày rất hiếm gặp,https://zingnews.vn/be-gai-3-tuoi-mac-benh-ly-xoan-da-day-rat-hiem-gap-post1397404.html,https://znews-photo.zingcdn.me/w360/Uploaded/gtnvzv/2023_01_30/xoan_da_day.jpg,SỨC KHỎE,"Trước đó, trẻ được chẩn đoán rối loạn tiêu hóa. Bệnh nhi được truyền dịch, thụt hậu môn tuy nhiên các triệu chứng không cải thiện, thậm chí tình trạng đau bụng tăng lên.",Phương Anh,30/1/2023 12:45 (GMT+7)
467,5 quyển sách ngắn cho người bận rộn,https://zingnews.vn/5-quyen-sach-ngan-cho-nguoi-ban-ron-post1397366.html,https://znews-photo.zingcdn.me/w360/Uploaded/ovunhuo/2023_01_30/pexels_mikhail_nilov_9784076_1__1.jpg,LIFESTYLE,"Chỉ gói gọn trong chưa tới 300 trang, những đầu sách sau là lựa chọn phù hợp cho một cuối tuần rảnh rỗi của bất kỳ ai.",,
468,Bé 6 tháng tuổi bị bảo mẫu bạo hành vẫn hôn mê sâu,https://zingnews.vn/be-6-thang-tuoi-bi-bao-mau-bao-hanh-van-hon-me-sau-post1395524.html,https://znews-photo.zingcdn.me/w360/Uploaded/lce_mdlwc/2023_01_20/bao_hanh_ok_200.jpeg,XÃ HỘI,"Sau 20 ngày được điều trị tại Bệnh viện Nhi đồng thành phố (TP.HCM), bé 6 tháng tuổi bị bảo mẫu bạo hành vẫn chưa qua cơn nguy kịch.",Anonymous,30/1/2023 10:56 (GMT+7)
469,"Nếu Ten Hag chơi game, MU nên mua tiền đạo nào",https://zingnews.vn/neu-ten-hag-choi-game-mu-nen-mua-tien-dao-nao-post1397169.html,https://znews-photo.zingcdn.me/w360/Uploaded/ivpbciv2/2023_01_29/Victor_Osimhen_Reuters.jpeg,CÔNG NGHỆ,"Trong khi Goncalo Ramos hay Osimhen đều không có hiệu suất ghi bàn như mong đợi, người cũ Depay lại bất ngờ mang đến thành công khi trở lại MU trong game giả lập Football Manager.",Anh Tuấn,30/1/2023 10:40 (GMT+7)
470,TP.HCM se lạnh sáng đầu năm,https://zingnews.vn/tphcm-se-lanh-sang-dau-nam-post1397376.html,https://znews-photo.zingcdn.me/w360/Uploaded/gtnzna/2023_01_30/DSC_6296_zing_1.jpg,XÃ HỘI,"Những ngày đầu năm, TP.HCM và khu vực Nam Bộ đón đợt không khí lạnh khiến nhiệt độ giảm còn 20-23 độ C vào sáng sớm. Sang tuần, dự báo thành phố có mưa trái mùa.",Thư Trần,30/1/2023 10:05 (GMT+7)
471,Những điểm đáng mong chờ của giải VĐQG Night Wolf 2023,https://zingnews.vn/nhung-diem-dang-mong-cho-cua-giai-vdqg-night-wolf-2023-post1397356.html,https://znews-photo.zingcdn.me/w360/Uploaded/wyhktpu/2023_01_30/thumb.jpg,THỂ THAO,Giải vô địch quốc gia Night Wolf 2023 với nhiều thay đổi mới lạ trong thể thức thi đấu sẽ bắt đầu được trình chiếu trọn vẹn và duy nhất trên hệ thống FPT Play từ ngày 3/2.,Hạnh Trà,30/1/2023 10:00 (GMT+7)
472,Loạt siêu xe ấn tượng tại Motorcar Cavalcade Concours d'Elegance 2023,https://zingnews.vn/loat-sieu-xe-an-tuong-tai-motorcar-cavalcade-concours-d-elegance-2023-post1397221.html,https://znews-photo.zingcdn.me/w360/Uploaded/aobhuua/2023_01_29/Motorcar_Cavalcade_Concours_d_Elegance_2023.jpg,XE,"Tương tự Monterey Car Week, sự kiện thường niên này là nơi quy tụ nhiều mẫu xe quý hiếm và hấp dẫn trên toàn thế giới.",Việt Hà,30/1/2023 09:35 (GMT+7)
473,Chelsea ra giá kỷ lục mua Enzo Fernandez,https://zingnews.vn/chelsea-ra-gia-ky-luc-mua-enzo-fernandez-post1397352.html,https://znews-photo.zingcdn.me/w360/Uploaded/wobjcak/2023_01_30/enzo.jpeg,THỂ THAO,Chelsea vẫn chưa muốn dừng lại trên thị trường chuyển nhượng khi sẵn sàng chi số tiền lớn để đem về Enzo Fernandez từ Benfica.,Duy Luân,30/1/2023 08:53 (GMT+7)
474,Hai diễn viên Hàn Quốc bị chê là 'bình hoa di động',https://zingnews.vn/hai-dien-vien-han-quoc-bi-che-la-binh-hoa-di-dong-post1397300.html,https://znews-photo.zingcdn.me/w360/Uploaded/qfssu/2023_01_29/VOI_1.jpg,GIẢI TRÍ,Son Na Eun và Kim Da Som bắt đầu sự nghiệp với vai trò ca sĩ thần tượng. Họ đang tham gia phim truyền hình nhưng diễn xuất gây tranh cãi.,Minh Hạo,30/1/2023 07:36 (GMT+7)
475,Thước đo thành công của người Hàn đang thay đổi,https://zingnews.vn/thuoc-do-thanh-cong-cua-nguoi-han-dang-thay-doi-post1397234.html,https://znews-photo.zingcdn.me/w360/Uploaded/mdf_drkydd/2023_01_29/z4069544866060_607ac21c70e45141fa0135b324dd9c18_1.jpg,ĐỜI SỐNG,Ngày càng nhiều người dân xứ kim chi tin rằng thành công là khi con cái họ tìm được công việc yêu thích chứ không phải đậu vào trường đại học hàng đầu hoặc làm cho tập đoàn lớn.,Thiên Nhi,30/1/2023 07:28 (GMT+7)
476,Begpacker - kiểu khách du lịch đi đến đâu xin tiền đến đó,https://zingnews.vn/begpacker-kieu-khach-du-lich-di-den-dau-xin-tien-den-do-post1397270.html,https://znews-photo.zingcdn.me/w360/Uploaded/neg_esfjaex/2023_01_29/Thumb_3.jpg,,"Begpacker thường lợi dụng lòng tốt của người dân địa phương, họ xin tiền để thỏa thích du lịch, ăn chơi.",Thái An,30/1/2023 07:00 (GMT+7)
477,"Miền Bắc sắp mưa phùn, nồm ẩm",https://zingnews.vn/mien-bac-sap-mua-phun-nom-am-post1397303.html,https://znews-photo.zingcdn.me/w360/Uploaded/lce_qjlcv/2021_06_22/mua_PN1.jpg,XÃ HỘI,"Thời tiết miền Bắc duy trì nhiều nắng, rét khô trong các ngày 30-31/1, sau đó khu vực bước vào giai đoạn tăng nhiệt, mưa phùn và nồm ẩm. Cùng lúc, Nam Bộ mưa dông vài nơi.",Mỹ Hà,30/1/2023 06:00 (GMT+7)
478,Napoli tạo khoảng cách 13 điểm trong cuộc đua vô địch Serie A,https://zingnews.vn/napoli-tao-khoang-cach-13-diem-trong-cuoc-dua-vo-dich-serie-a-post1397329.html,https://znews-photo.zingcdn.me/w360/Uploaded/natmzz/2023_01_30/oo.JPG,THỂ THAO,"Rạng sáng 30/1 (giờ Hà Nội), Osimhen cùng đồng đội đánh bại Roma 2-1 để xây chắc ngôi đầu Serie A sau 20 vòng đấu.",Tuấn Nguyên,30/1/2023 05:18 (GMT+7)
479,"Thua sốc Sassuolo, AC Milan tạo thống kê tệ nhất lịch sử",https://zingnews.vn/thua-soc-sassuolo-ac-milan-tao-thong-ke-te-nhat-lich-su-post1397293.html,https://znews-photo.zingcdn.me/w360/Uploaded/bpivpawv/2023_01_29/2023_01_29T121751Z_526182637_UP1EJ1T0Y5PG5_RTRMADP_3_SOCCER_ITALY_MIL_SAS_REPORT.JPG,THỂ THAO,AC Milan lập nhiều cột mốc buồn sau trận thua 2-5 trước Sassuolo ở vòng 20 Serie A diễn ra tối 29/1 (giờ Hà Nội).,Hồng An,29/1/2023 21:20 (GMT+7)
480,Lì xì bằng sách,https://zingnews.vn/li-xi-bang-sach-post1397264.html,https://znews-photo.zingcdn.me/w360/Uploaded/dqmblcvo/2019_06_27/7.jpg,XUẤT BẢN,"Suốt những năm tuổi thơ, cứ mỗi dịp Tết đến, ba tôi ở đơn vị thường gửi về một thùng sách cho anh em tôi.",Anonymous,29/1/2023 20:08 (GMT+7)
481,Thực phẩm cho người da khô,https://zingnews.vn/thuc-pham-cho-nguoi-da-kho-post1396972.html,https://znews-photo.zingcdn.me/w360/Uploaded/moguvt/2023_01_28/pexels_photo_6707512_1.jpg,SỨC KHỎE,"Bơ, gan bò, khoai lang, sữa đậu nành, hàu cùng nhiều thực phẩm khác giúp dưỡng ẩm và phục hồi da nhờ chứa nhiều chất dinh dưỡng như kẽm, vitamin A, vitamin E hay selen.",Nam Giao,29/1/2023 19:32 (GMT+7)
482,Thực hư thông tin nữ sinh 15 tuổi tử vong do uống 4 bát rượu liên tiếp,https://zingnews.vn/thuc-hu-thong-tin-nu-sinh-15-tuoi-tu-vong-do-uong-4-bat-ruou-lien-tiep-post1397249.html,https://znews-photo.zingcdn.me/w360/Uploaded/pwivovlb/2023_01_29/ruou_say.jpg,PHÁP LUẬT,"Trong lúc uống rượu, nữ sinh đi ra ngoài thì ngã gục. Thời điểm được bạn bè phát hiện, M. đã bất tỉnh.",Anonymous,29/1/2023 18:31 (GMT+7)
483,Nghi án loạn luân của công chúa triều Nguyễn,https://zingnews.vn/nghi-an-loan-luan-cua-cong-chua-trieu-nguyen-post1397194.html,https://znews-photo.zingcdn.me/w360/Uploaded/ofh_cgkztmzt/2023_01_29/41.jpg,XUẤT BẢN,"Sau bộ tiểu thuyết về thái hậu Từ Dụ, nhà văn Trần Thùy Mai tiếp tục đưa độc giả khám phá một giai đoạn khác về nhà Nguyễn, liên quan đến vụ án của công chúa Đồng Xuân.",Thụy Oanh,29/1/2023 14:17 (GMT+7)
484,Cùng bạn gái du lịch hơn 100 nước trong nhiều năm,https://zingnews.vn/cung-ban-gai-du-lich-hon-100-nuoc-trong-nhieu-nam-post1397189.html,https://znews-photo.zingcdn.me/w360/Uploaded/aeixrdbkxq/2023_01_29/230112090034_14_couple_traveled_every_country_last_1.jpg,ĐỜI SỐNG,"Từ năm 2018, Davey và Sebova cùng nhau đặt chân đến gần 100 quốc gia trên thế giới. Tuy nhiên, họ không dám tiết lộ là cặp đồng tính nữ nhằm tránh nguy hiểm khi du lịch.",Ánh Dương,29/1/2023 13:23 (GMT+7)
485,Ông Trump chỉ trích đối thủ DeSantis,https://zingnews.vn/ong-trump-chi-trich-doi-thu-desantis-post1397167.html,https://znews-photo.zingcdn.me/w360/Uploaded/ifyyy/2023_01_29/2023_01_28T234136Z_378747157_RC2YZY9TL6C6_RTRMADP_3_USA_TRUMP.JPG,THẾ GIỚI,"Trong chiến dịch tranh cử ở New Hampshire và Nam Carolina, cựu Tổng thống Trump đã nhắm tới Thống đốc Florida Ron DeSantis - đối thủ tiềm năng trong cuộc đua năm 2024.",Tuấn Đạt,
